id,data,codigo,descricao,previsto_mensal,realizado_mensal
11129,2009-06,1.1.1.2.02.01,IMPOSTO S/ A PROPRIEDADE PREDIAL,"R$ 253.791.666,67","R$ 229.439.215,35"
11141,2009-06,1.1.1.2.02.02,IMPOSTO S/ A PROPRIEDADE TERRITORIAL URBANA,"R$ 9.658.333,33","R$ 8.616.544,57"
11153,2009-06,1.1.1.2.04.31,IMPOSTO DE RENDA RETIDO NAS FONTES S/ OS RENDIMENTOS DO TRABALHO,"R$ 63.333.333,33","R$ 53.163.170,84"
11165,2009-06,1.1.1.2.04.33,IMPOSTO DE RENDA RETIDO NAS FONTES S/ REMESSA DE RECURSOS AO EXTERIOR,"R$ 0,00","R$ 0,00"
11177,2009-06,1.1.1.2.04.34,IMPOSTO DE RENDA RETIDO NAS FONTES S/ OUTROS RENDIMENTOS,"R$ 10.416.666,67","R$ 10.420.492,04"
11189,2009-06,1.1.1.2.08.01,IMPOSTO S/ TRANS. INTER-VIVOS  DE BENS IMÓVEIS E DIR. REAIS S/ IMÓVEIS,"R$ 49.050.000,00","R$ 60.423.900,14"
11201,2009-06,1.1.1.3.05.01,IMPOSTO SOBRE SERVIÇOS DE QUALQUER NATUREZA,"R$ 466.128.632,75","R$ 436.540.622,41"
11213,2009-06,1.1.1.3.05.02,ISS - SISTEMA INTEGRADO - SIMPLES,"R$ 241.666,67","R$ 55.777,09"
11225,2009-06,1.1.1.3.05.03,ISS - CMSP,"R$ 0,00","R$ 0,00"
11237,2009-06,1.1.1.3.05.04,ISS - SIMPLES NACIONAL,"R$ 29.083.333,33","R$ 29.853.438,40"
11249,2009-06,1.1.1.3.07,IMPOSTO S/ VENDA A VAREJO DE COMBUSTÍVEIS LÍQUIDOS E GASOSOS - IVV,"R$ 0,00","R$ 0,00"
11261,2009-06,1.1.2.1.25.01,"TAXA DE LICENÇA P/ LOCALIZAÇÃO, INSTALAÇÃO E FUNCIONAMENTO","R$ 0,00","R$ 0,00"
11273,2009-06,1.1.2.1.25.02,TAXA DE VISTORIA DE NORMAS DE SEGURANÇA,"R$ 0,00","R$ 0,00"
11285,2009-06,1.1.2.1.25.03,TAXA DE FISCALIZAÇÃO DE ESTABELECIMENTOS - TFE,"R$ 6.666.666,67","R$ 3.669.880,00"
11297,2009-06,1.1.2.1.26.01,TAXA DE FISCALIZAÇÃO DE ANÚNCIOS,"R$ 1.250.000,00","R$ 659.765,19"
11309,2009-06,1.1.2.1.32.01,TAXA P/ EXAME E VERIFICAÇÃO DE  PROJETOS E CONSTRUÇÕES,"R$ 5.000.000,00","R$ 3.055.483,93"
11321,2009-06,1.1.2.1.34.01,TAXA DE VISTORIA DE APARELHOS DE TRANSPORTE VERTICAL E HORIZONTAL,"R$ 583.333,33","R$ 77.207,08"
11333,2009-06,1.1.2.1.99.01,TAXA DE LICENÇA P/ TRÁFEGO DE VEÍCULOS,"R$ 6.783,33","R$ 0,00"
11345,2009-06,1.1.2.1.99.02,TAXA DE LICENÇA P/ ARRUAMENTOS E LOTEAMENTOS,"R$ 0,00","R$ 0,00"
11357,2009-06,1.1.2.1.99.03,TAXA DE FISCALIZAÇÃO DOS SERVIÇOS DE LIMPEZA URBANA - FISLURB,"R$ 166.666,67","R$ 13.000,30"
11369,2009-06,1.1.2.1.99.04,TAXA DE REMOÇÃO - CET,"R$ 75.833,33","R$ 1.024.200,78"
11381,2009-06,1.1.2.1.99.05,TAXA DE FISCALIZAÇÃO DE CEMITÉRIOS,"R$ 87.500,00","R$ 91.733,28"
11393,2009-06,1.1.2.2.90.01,TAXA DE LIMPEZA PÚBLICA,"R$ 2.200,00","R$ 2.184,19"
11405,2009-06,1.1.2.2.90.02,TAXA DE RESÍDUOS SÓLIDOS DOMICILIARES - TRSD,"R$ 208.333,33","R$ 9.609,48"
11417,2009-06,1.1.2.2.90.03,TAXA DE RESÍDUOS SÓLIDOS DE SERVIÇOS DE SAÚDE - TRSS,"R$ 3.333.333,33","R$ 1.044.622,97"
11429,2009-06,1.1.2.2.99.01,TAXA DE CONSERVAÇÃO DE VIAS E LOGRADOUROS PÚBLICOS,"R$ 333,33","R$ 493,14"
11441,2009-06,1.1.2.2.99.02,TAXA DE ESTUDOS P/ FIXAÇÃO DE DIRETRIZES,"R$ 54.166,67","R$ 100.758,62"
11453,2009-06,1.1.2.2.99.03,TAXA DE COMBATE A SINISTROS,"R$ 8.333,33","R$ 6.022,47"
11465,2009-06,1.1.3.0.00.01,CONTRIBUIÇÃO DE MELHORIA,"R$ 7.500,00","R$ 251,82"
11477,2009-06,1.1.4,RECEITA TRIBUTÁRIA A CLASSIFICAR,"R$ 0,00","R$ 218.894,15"
11489,2009-06,1.1.5,RECEITAS A CLASSIFICAR - DAMSP,"R$ 0,00","R$ 126.333,86"
11501,2009-06,1.2.1.0.01.01,PMSP,"R$ 0,00","R$ 0,00"
11513,2009-06,1.2.1.0.01.02,CÂMARA MUNICIPAL,"R$ 0,00","R$ 0,00"
11525,2009-06,1.2.1.0.01.03,TRIBUNAL DE CONTAS DO MUNICÍPIO DE SÃO PAULO,"R$ 0,00","R$ 0,00"
11537,2009-06,1.2.1.0.01.04,IPREM,"R$ 0,00","R$ 0,00"
11549,2009-06,1.2.1.0.01.05,PENSIONISTAS - IPREM,"R$ 0,00","R$ 0,00"
11561,2009-06,1.2.1.0.01.06,SERVIÇO FUNERÁRIO DE SÃO PAULO,"R$ 0,00","R$ 0,00"
11573,2009-06,1.2.1.0.01.07,CONTRIBUIÇÃO PESSOAL HSPM/CLT,"R$ 0,00","R$ 0,00"
11585,2009-06,1.2.1.0.29.01,CONTRIBUIÇÃO PATRONAL DE SERVIDOR ATIVO CIVIL PARA,"R$ 56.000,00","R$ 0,00"
11597,2009-06,1.2.1.0.29.01,CONTRIBUIÇÃO PATRONAL DE SERVIDOR ATIVO CIVIL PARA,"R$ 0,00","R$ 53.500,56"
11609,2009-06,1.2.1.0.29.07,CONTRIBUIÇÃO DO SERVIDOR ATIVO CIVIL PARA O REGIME,"R$ 41.130.831,83","R$ 0,00"
11621,2009-06,1.2.1.0.29.07,CONTRIBUIÇÃO DO SERVIDOR ATIVO CIVIL PARA O REGIME,"R$ 0,00","R$ 36.809.057,61"
11633,2009-06,1.2.1.0.29.07,CONTRIBUIÇÃO DO SERVIDOR ATIVO CIVIL PARA O REGIME,"R$ 0,00","R$ 449.092,85"
11645,2009-06,1.2.1.0.29.07,CONTRIBUIÇÃO DO SERVIDOR ATIVO CIVIL PARA O REGIME,"R$ 0,00","R$ 1.079.091,68"
11657,2009-06,1.2.1.0.29.07,CONTRIBUIÇÃO DO SERVIDOR ATIVO CIVIL PARA O REGIME,"R$ 0,00","R$ 10.464,95"
11669,2009-06,1.2.1.0.29.07,CONTRIBUIÇÃO DO SERVIDOR ATIVO CIVIL PARA O REGIME,"R$ 0,00","R$ 192.507,22"
11681,2009-06,1.2.1.0.29.07,CONTRIBUIÇÃO DO SERVIDOR ATIVO CIVIL PARA O REGIME,"R$ 0,00","R$ 0,00"
11693,2009-06,1.2.1.0.29.07,CONTRIBUIÇÃO DO SERVIDOR ATIVO CIVIL PARA O REGIME,"R$ 0,00","R$ 0,00"
11705,2009-06,1.2.1.0.29.07,CONTRIBUIÇÃO DO SERVIDOR ATIVO CIVIL PARA O REGIME,"R$ 0,00","R$ 0,00"
11717,2009-06,1.2.1.0.29.07,CONTRIBUIÇÃO DO SERVIDOR ATIVO CIVIL PARA O REGIME,"R$ 0,00","R$ 0,00"
11729,2009-06,1.2.1.0.29.07,CONTRIBUIÇÃO DO SERVIDOR ATIVO CIVIL PARA O REGIME,"R$ 0,00","R$ 0,00"
11741,2009-06,1.2.1.0.29.07,CONTRIBUIÇÃO DO SERVIDOR ATIVO CIVIL PARA O REGIME,"R$ 0,00","R$ 37.236,07"
11753,2009-06,1.2.1.0.29.07,CONTRIBUIÇÃO DO SERVIDOR ATIVO CIVIL PARA O REGIME,"R$ 0,00","R$ 29.505,31"
11765,2009-06,1.2.1.0.29.07,CONTRIBUIÇÃO DO SERVIDOR ATIVO CIVIL PARA O REGIME,"R$ 0,00","R$ 254.555,98"
11777,2009-06,1.2.1.0.29.09,CONTRIBUIÇÕES DO SERVIDOR INATIVO CIVIL PARA O REG,"R$ 4.710.166,67","R$ 0,00"
11789,2009-06,1.2.1.0.29.09,CONTRIBUIÇÕES DO SERVIDOR INATIVO CIVIL PARA O REG,"R$ 0,00","R$ 6.697.665,56"
11801,2009-06,1.2.1.0.29.09,CONTRIBUIÇÕES DO SERVIDOR INATIVO CIVIL PARA O REG,"R$ 0,00","R$ 406.341,26"
11813,2009-06,1.2.1.0.29.09,CONTRIBUIÇÕES DO SERVIDOR INATIVO CIVIL PARA O REG,"R$ 0,00","R$ 183.503,47"
11825,2009-06,1.2.1.0.29.09,CONTRIBUIÇÕES DO SERVIDOR INATIVO CIVIL PARA O REG,"R$ 0,00","R$ 3.035,57"
11837,2009-06,1.2.1.0.29.09,CONTRIBUIÇÕES DO SERVIDOR INATIVO CIVIL PARA O REG,"R$ 0,00","R$ 32.392,95"
11849,2009-06,1.2.1.0.29.11,CONTRIBUIÇÕES DE PENSIONISTA CIVIL PARA O REGIME P,"R$ 956.000,00","R$ 0,00"
11861,2009-06,1.2.1.0.29.11,CONTRIBUIÇÕES DE PENSIONISTA CIVIL PARA O REGIME P,"R$ 0,00","R$ 939.555,36"
11873,2009-06,1.2.1.0.46.01,COMPENSAÇÃO PREVID. ENTRE RGPS E OS RPPS,"R$ 0,00","R$ 0,00"
11885,2009-06,1.2.2.0.29.01,CONTRIBUIÇÃO P/ O CUSTEIO DO SERVIÇO DE ILUMINAÇÃO PÚBLICA - COSIP/FUN,"R$ 16.500.000,00","R$ 15.013.796,45"
11897,2009-06,1.3.1.1.99,OUTRAS RECEITAS DE ALUGUÉIS,"R$ 0,00","R$ 0,00"
11909,2009-06,1.3.1.1.99,OUTRAS RECEITAS DE ALUGUÉIS,"R$ 0,00","R$ 0,00"
11921,2009-06,1.3.1.9.01.01,OUTRAS RECEITAS IMOBILIARIAS,"R$ 0,00","R$ 0,00"
11933,2009-06,1.3.1.9.01.01,OUTRAS RECEITAS IMOBILIARIAS,"R$ 0,00","R$ 0,00"
11945,2009-06,1.3.2.2.00.01,DIVIDENDOS,"R$ 83,33","R$ 0,00"
11957,2009-06,1.3.2.2.00.01,DIVIDENDOS,"R$ 83,33","R$ 414,16"
11969,2009-06,1.3.2.3.00.01,PARTICIPAÇÕES,"R$ 0,00","R$ 0,00"
11981,2009-06,1.3.2.5.01.01,RECEITA DE REMUNERAÇÃO DE DEPÓSITOS BANCÁRIOS DE RECURSOS VINCULADOS -,"R$ 0,00","R$ 0,00"
11993,2009-06,1.3.2.5.01.02,RECEITA DE REMUNERAÇÃO DE DEPÓSITOS BANCÁRIOS DE RECURSOS VINCULADOS -,"R$ 2.646.666,67","R$ 3.780.232,13"
12005,2009-06,1.3.2.5.01.03,RECEITA DE REMUNERAÇÃO DE DEPÓSITOS BANCÁRIOS DE RECURSOS VINCULADOS -,"R$ 0,00","R$ 0,00"
12017,2009-06,1.3.2.5.01.03,RECEITA DE REMUNERAÇÃO DE DEPÓSITOS BANCÁRIOS DE RECURSOS VINCULADOS -,"R$ 0,00","R$ 0,00"
12029,2009-06,1.3.2.5.01.05,RECEITA DE REMUNERAÇÃO DE DEPÓSITOS BANCÁRIOS DE RECURSOS VINCULADOS -,"R$ 0,00","R$ 0,00"
12041,2009-06,1.3.2.5.01.06,RECEITA DE REMUN.DE DEP. BANCÁRIOS DE REC. VINCULADOS - FUNDO DE SAÚDE,"R$ 700,00","R$ 1.081,23"
12053,2009-06,1.3.2.5.01.99,RECEITA DE REMUNERAÇÃO DE OUTROS DEPÓSITOS BANCÁRIOS DE RECURSOS VINCU,"R$ 416.666,67","R$ 0,00"
12065,2009-06,1.3.2.5.02.01,RECEITA DE REMUNERAÇÃO DE DEPÓSITOS DE POUPANÇA,"R$ 102.583,33","R$ 0,00"
12077,2009-06,1.3.2.6.00.01,CONVÊNIO PMSP/SDTS - PLANSINE - FAT,"R$ 0,00","R$ 0,00"
12089,2009-06,1.3.2.6.00.02,CONVÊNIO PMSP/SDTS - PLANTEQ/2004 - FAT,"R$ 0,00","R$ 0,00"
12101,2009-06,1.3.2.6.00.03,CONVÊNIO MTE/SPPE/CODEFAT,"R$ 0,00","R$ 19.664,78"
12113,2009-06,1.3.2.8.10.01,REMUNERAÇÃO DOS INVESTIMENTOS EM RENDA FIXA,"R$ 1.384.989,50","R$ 85.214,44"
12125,2009-06,1.3.2.9.01.01,PMSP,"R$ 29.050.000,00","R$ 21.527.250,79"
12137,2009-06,1.3.2.9.01.02,CÂMARA MUNICIPAL DE SÃO PAULO,"R$ 1.033.333,33","R$ 0,00"
12149,2009-06,1.3.2.9.01.03,TRIBUNAL DE CONTAS DO MUNICÍPIO DE SÃO PAULO,"R$ 29.166,67","R$ 106.408,91"
12161,2009-06,1.3.2.9.01.04,CEF - VALOR BLOQUEADO,"R$ 0,00","R$ 0,00"
12173,2009-06,1.3.2.9.01.05,OPERAÇÃO URBANA FARIA LIMA,"R$ 0,00","R$ 0,00"
12185,2009-06,1.3.2.9.01.06,OPERAÇÕES INTERLIGADAS,"R$ 2.083.333,33","R$ 40.638,40"
12197,2009-06,1.3.2.9.01.07,OPERAÇÃO URBANA ANHANGABAÚ,"R$ 0,00","R$ 0,00"
12209,2009-06,1.3.2.9.01.08,FUNDO ESPECIAL OPERAÇÃO URBANA ÁGUA BRANCA - FEAB,"R$ 0,00","R$ 0,00"
12221,2009-06,1.3.2.9.01.09,FEHIDRO - FUNDO ESTADUAL DE RECURSOS HÍDRICOS,"R$ 0,00","R$ 0,00"
12233,2009-06,1.3.2.9.01.10,PROGRAMA NACIONAL DE ALIMENTAÇÃO ESCOLAR - PNAE/FNDE,"R$ 192.346,08","R$ 41.995,10"
12245,2009-06,1.3.2.9.01.11,CONVÊNIO PMSP - MINISTÉRIO DA INTEGRAÇÃO NACIONAL - SEDEC,"R$ 0,00","R$ 0,00"
12257,2009-06,1.3.2.9.01.12,CONTRIBUIÇÃO PARA O CUSTEIO DO SERVIÇO DE ILUMINAÇÃO PÚBLICA - COSIP/F,"R$ 208.333,33","R$ 173.388,36"
12269,2009-06,1.3.2.9.01.13,INCENTIVO P/ A ATENÇÃO À SAÚDE NO SISTEMA PENITENCIÁRIO - SUS/FNS,"R$ 83,33","R$ 0,00"
12281,2009-06,1.3.2.9.01.14,PROGRAMA NACIONAL DE ALIMENTAÇÃO ESCOLAR - PNAE-CRECHE-SEMAB-FNDE,"R$ 239.487,25","R$ 0,00"
12293,2009-06,1.3.2.9.01.15,PLANO MUNICIPAL DE QUALIFICAÇÃO SOCIAL E PROFISSIONAL - PNQ/TEM,"R$ 0,00","R$ 0,00"
12305,2009-06,1.3.2.9.01.16,PROJETOS MUNICIPAIS DE EXPANSÃO DA SAÚDE DA FAMÍLIA - PROESF - FNS/FMS,"R$ 83,33","R$ 0,00"
12317,2009-06,1.3.2.9.01.19,PROGRAMA SÓCIO-EDUCATIVO EM MEIO ABERTO - ESPAÇO AMIGO - SAS,"R$ 0,00","R$ 0,00"
12329,2009-06,1.3.2.9.01.20,PROGRAMA DE ASSISTÊNCIA FARMACÊUTICA BÁSICA DO ESTADO DE SÃO PAULO - D,"R$ 35.583,33","-R$ 321,63"
12341,2009-06,1.3.2.9.01.21,PROGRAMA PPD - SEGMENTO PESSOA COM DEFICIÊNCIA - SAS,"R$ 0,00","R$ 0,00"
12353,2009-06,1.3.2.9.01.22,CONVÊNIO Nº 800072/03 - FNDE/MEC - EDUCAÇÃO PRÉ-ES,"R$ 0,00","R$ 0,00"
12365,2009-06,1.3.2.9.01.23,CONVÊNIO Nº 804142/03 - FNDE/MEC -  ENSINO FUNDAME,"R$ 0,00","R$ 0,00"
12377,2009-06,1.3.2.9.01.24,CONVÊNIO Nº 808065/03 - FNDE/MEC - EDUCAÇÃO DE JOV,"R$ 0,00","R$ 0,00"
12389,2009-06,1.3.2.9.01.25,FUNDO ESPECIAL DE DESPESAS DA CÂMARA MUNICIPAL DE SÃO PAULO,"R$ 287.250,00","R$ 1.900.000,00"
12401,2009-06,1.3.2.9.01.27,PROGRAMA DE REESTRUTURAÇÃO URBANA - SISTEMA VIÁRIO JACU-PÊSSEGO/MINIST,"R$ 0,00","R$ 0,00"
12413,2009-06,1.3.2.9.01.28,CONVÊNIO N° 816169/2003-FNDE/MEC - EDUCAÇÃO ESPECI,"R$ 0,00","R$ 0,00"
12425,2009-06,1.3.2.9.01.31,FMAS - PROJETO RESTAURANTE ESCOLA,"R$ 564,67","R$ 0,00"
12437,2009-06,1.3.2.9.01.33,CENTRO MUNICIPAL DE EDUCAÇÃO TECNOLÓGICA - CONVÊNIO MEC/CEFET-SP,"R$ 9.500,00","R$ 0,00"
12449,2009-06,1.3.2.9.01.34,PROGRAMA @ LIS/ALIANÇA PARA A SOCIEDADE DA INFORMAÇÃO - SMCIS,"R$ 0,00","R$ 0,00"
12461,2009-06,1.3.2.9.01.35,PMSP/SMRI - SAÚDE PÚBLICA,"R$ 0,00","R$ 0,00"
12473,2009-06,1.3.2.9.01.36,PROTEÇÃO SOCIAL BÁSICA/FMAS,"R$ 10.000,00","R$ 0,00"
12485,2009-06,1.3.2.9.01.37,PROTEÇÃO SOCIAL ESPECIAL/FMAS,"R$ 0,00","R$ 6.224,44"
12497,2009-06,1.3.2.9.01.38,PROGRAMA BRASIL POTÊNCIA ESPORTIVA,"R$ 0,00","R$ 0,00"
12509,2009-06,1.3.2.9.01.40,MINISTÉRIO DO ESPORTE/CEF X SEME,"R$ 26.208,33","R$ 0,00"
12521,2009-06,1.3.2.9.01.41,PMSP/SAS/FMAS,"R$ 2.585,92","R$ 120.976,76"
12533,2009-06,1.3.2.9.01.42,CONVÊNIO MEC/FNDE - ASSISTÊNCIA FINANCEIRA A PROGRAMAS E PROJETOS EDUC,"R$ 8.079,83","R$ 0,00"
12545,2009-06,1.3.2.9.01.43,RADIAL LESTE,"R$ 0,00","R$ 0,00"
12557,2009-06,1.3.2.9.01.44,PROGRAMA NACIONAL DE APOIO AO TRANSPORTE DO ESCOLAR - PNATE,"R$ 617,58","R$ 0,00"
12569,2009-06,1.3.2.9.01.45,"PROGRAMA URB-AL, REDE N° 10","R$ 0,00","R$ 0,00"
12581,2009-06,1.3.2.9.01.46,MÉDIA E ALTA COMPLEXIDADE VIGILÂNCIA SANITÁRIA - MAC - FNS/FMS,"R$ 25.833,33","R$ 0,00"
12593,2009-06,1.3.2.9.01.50,SECRETARIA DE ESTADO DA SAÚDE - SMS/FMS,"R$ 7.916,67","R$ 187.806,77"
12605,2009-06,1.3.2.9.01.51,PROGRAMA URB-AL - PROJETO COMUM R3-B1-04 - OBSERVATÓRIOS LOCAIS DA DEM,"R$ 0,00","R$ 0,00"
12617,2009-06,1.3.2.9.01.52,PROGRAMA CENTROS DE ESPECIALIDADES ODONTOLÓGICAS - FNS/SMS,"R$ 9.500,00","R$ 0,00"
12629,2009-06,1.3.2.9.01.53,FEPAC,"R$ 3.333,33","R$ 0,00"
12641,2009-06,1.3.2.9.01.54,FUMCAD,"R$ 504.106,83","R$ 193.702,50"
12653,2009-06,1.3.2.9.01.55,FUTUR,"R$ 0,00","R$ 0,00"
12665,2009-06,1.3.2.9.01.56,FUNCOR,"R$ 0,00","R$ 0,00"
12677,2009-06,1.3.2.9.01.57,FUNDO CONSTITUCIONAL DA EDUCAÇÃO,"R$ 133.333,33","R$ 0,00"
12689,2009-06,1.3.2.9.01.58,FMAS - FUNDO MUNICIPAL DE ASSISTÊNCIA SOCIAL,"R$ 14.406,67","R$ 5.417,36"
12701,2009-06,1.3.2.9.01.59,FEMA - FUNDO ESPECIAL DO MEIO AMBIENTE E DESENVVOLVIMENTO SUSTENTÁVEL,"R$ 179.166,67","R$ 74.763,95"
12713,2009-06,1.3.2.9.01.60,PETI-PROGRAMA DE ERRADICAÇÃO DO TRABALHO INFANTIL - FNAS/FMAS,"R$ 9.078,17","R$ 0,00"
12725,2009-06,1.3.2.9.01.61,VIGISUS - FORTALECIMENTO DA GESTÃO EM VIGILÂNCIA - MS-FNS - SMS/FMS,"R$ 8.500,00","R$ 28.093,64"
12737,2009-06,1.3.2.9.01.62,CONVÊNIO PMSP/SMPP X UNIÃO,"R$ 0,00","R$ 0,00"
12749,2009-06,1.3.2.9.01.63,TERMINAL DE CARGAS FERNÃO DIAS/MT-DNIT/SP-MG,"R$ 0,00","R$ 0,00"
12761,2009-06,1.3.2.9.01.64,CONVÊNIO SSP/SP - SGM/CSU,"R$ 0,00","R$ 0,00"
12773,2009-06,1.3.2.9.01.65,PROGRAMA URB-AL - PROJETO COMUM R12 A1-04,"R$ 0,00","R$ 0,00"
12785,2009-06,1.3.2.9.01.66,OUTROS PROGRAMAS FINANCIADOS P/ TRANSFERÊNCIAS FUNDO A FUNDO,"R$ 160.250,00","R$ 307.686,56"
12797,2009-06,1.3.2.9.01.67,PROGRAMA URB - AL,"R$ 0,00","R$ 0,00"
12809,2009-06,1.3.2.9.01.68,CONVÊNIO MTE/SPPE X PMSP/SMTRAB - PROJOVEM,"R$ 0,00","R$ 0,00"
12821,2009-06,1.3.2.9.01.69,CONVÊNIO SENASP,"R$ 0,00","R$ 0,00"
12833,2009-06,1.3.2.9.01.70,RENDIMENTOS DE APLICAÇÕES FINANCEIRAS - ADM. INDIR,"R$ 154.166,67","R$ 36.519,86"
12845,2009-06,1.3.2.9.01.71,CONVÊNIO CITY JARAGUÁ,"R$ 2.234,83","R$ 0,00"
12857,2009-06,1.3.2.9.01.72,FUNCAP,"R$ 0,00","R$ 0,00"
12869,2009-06,1.3.2.9.01.73,CONVÊNIO SIURB - ESTADO,"R$ 0,00","R$ 0,00"
12881,2009-06,1.3.2.9.01.74,CONVÊNIO SMADS - UNIÃO EUROPÉIA,"R$ 0,00","R$ 0,00"
12893,2009-06,1.3.2.9.01.75,PMSP/SMADS/FMAS - PAC II POP RUA,"R$ 1.673,83","R$ 993,24"
12905,2009-06,1.3.2.9.01.76,CONVÊNIO PMSP/SMRI/REGIÃO ILE DE FRANCE,"R$ 833,33","R$ 0,00"
12917,2009-06,1.3.2.9.01.77,CONVÊNIO MINISTÉRIO DO TURISMO,"R$ 0,00","R$ 0,00"
12929,2009-06,1.3.2.9.01.78,RENDIMENTOS DE APLICAÇÕES FINANCEIRAS - ADM. INDIR,"R$ 216.666,67","R$ 264.130,37"
12941,2009-06,1.3.2.9.01.79,CONVÊNIO SME - ESTADO,"R$ 0,00","R$ 0,00"
12953,2009-06,1.3.2.9.01.81,INSTITUIÇÕES PRIVADAS X SMS,"R$ 416,67","R$ 6.228,20"
12965,2009-06,1.3.2.9.01.82,CONVÊNIO SMC - EXTERIOR,"R$ 0,00","R$ 0,00"
12977,2009-06,1.3.2.9.01.83,RENDIMENTOS DE APLICAÇÕES FINANCEIRAS - ADM. INDIR,"R$ 0,00","R$ 0,00"
12989,2009-06,1.3.2.9.01.84,FMDT,"R$ 0,00","R$ 0,00"
13001,2009-06,1.3.2.9.01.85,CONVÊNIO SIURB X EMURB,"R$ 0,00","R$ 0,00"
13013,2009-06,1.3.2.9.01.86,OPERAÇÃO URBANA ÁGUA ESPRAIADA - TRANSPORTES,"R$ 0,00","R$ 0,00"
13025,2009-06,1.3.2.9.01.87,OPERAÇÃO URBANA FARIA LIMA - TRANSPORTES,"R$ 0,00","R$ 0,00"
13037,2009-06,1.3.2.9.02.01,TRANSFERÊNCIAS DO SALÁRIO EDUCAÇÃO - LEI 10.832/03,"R$ 2.083.333,33","R$ 613.315,94"
13049,2009-06,1.3.2.9.02.02,CONVÊNIOS MINC/SMC,"R$ 0,00","R$ 0,00"
13061,2009-06,1.3.3.9.99.01,"RENDAS DE MERCADOS, FEIRAS E FRIGORÍFICOS (ANT. MAT.) - SISTEMA VELHO","R$ 1.750,00","R$ 0,00"
13073,2009-06,1.3.3.9.99.02,"RENDAS DE MERCADOS, FEIRAS E FRIGORÍFICOS (ANT. MAT.) - SISTEMA NOVO","R$ 1.250.000,00","R$ 1.044.926,42"
13085,2009-06,1.3.3.9.99.03,ESTÁDIO MUNICIPAL,"R$ 208.333,33","R$ 504.860,71"
13097,2009-06,1.3.3.9.99.04,AUTÓDROMO,"R$ 0,00","R$ 0,00"
13109,2009-06,1.3.3.9.99.05,KARTÓDROMO,"R$ 0,00","R$ 0,00"
13121,2009-06,1.3.3.9.99.06,CENTROS ESPORTIVOS - UNIDADES EDUCACIONAIS E ESPORTIVAS,"R$ 15.000,00","R$ 18.792,50"
13133,2009-06,1.3.3.9.99.07,CENTROS CULTURAIS - TEATROS/PMSP,"R$ 0,00","R$ 0,00"
13145,2009-06,1.3.3.9.99.08,CENTROS CULTURAIS - TEATROS/FEPAC,"R$ 83.333,33","R$ 10.623,30"
13157,2009-06,1.3.3.9.99.09,PERMISSÃO DE ATIVIDADES AMBULANTES,"R$ 0,00","R$ 0,00"
13169,2009-06,1.3.3.9.99.10,TARIFA DE PEDÁGIO P/ INGRESSO NAS RUAS DE PEDESTRES,"R$ 41.666,67","R$ 27.609,86"
13181,2009-06,1.3.3.9.99.12,CONCESSÃO PARA EXPLORAÇÃO COMERCIAL EM ESTACIONAMENTO SUBTERRÂNEO - SM,"R$ 4.166,67","R$ 7.598,33"
13193,2009-06,1.3.3.9.99.13,"IMPLANTAÇÃO, INSTALAÇÃO E PASSAGEM DE EQUIPAMENTOS URBANOS - CONVIAS","R$ 75.000,00","R$ 67.240,94"
13205,2009-06,1.3.3.9.99.14,OUTORGA ONEROSA - PRESTAÇÃO DE SERVIÇOS DE LIMPEZA URBANA EM REGIME PÚ,"R$ 0,00","R$ 0,00"
13217,2009-06,1.3.3.9.99.15,CONTRATOS DE CONCESSÃO E PERMISSÃO DOS SERVIÇOS DE LIMPEZA URBANA - FM,"R$ 4.166.666,67","R$ 3.637.838,81"
13229,2009-06,1.3.3.9.99.16,OUTRAS RECEITAS DE CONCESSÕES E PERMISSÕES,"R$ 1.000,00","R$ 0,00"
13241,2009-06,1.3.3.9.99.17,UNIDADES ESPORTIVAS DA SEME,"R$ 10.000,00","R$ 150,00"
13253,2009-06,1.3.4.0.01,UTILIZAÇÃO DE RECURSOS HÍDRICOS - ITAIPU,"R$ 83,33","R$ 0,00"
13265,2009-06,1.3.9.0.01.01,REMUNERAÇÕES DIVERSAS,"R$ 266.666,67","R$ 294.597,46"
13277,2009-06,1.3.9.0.02.01,BANCO ITAÚ S/A.,"R$ 0,00","R$ 0,00"
13289,2009-06,1.3.9.0.02.03,BANCO BRADESCO S/A.,"R$ 0,00","R$ 0,00"
13301,2009-06,1.5.2.0.28.01,SUBPRODUTOS DA LIMPEZA PÚBLICA,"R$ 0,00","R$ 0,00"
13313,2009-06,1.5.2.0.29.01,GRÁFICA MUNICIPAL,"R$ 0,00","R$ 0,00"
13325,2009-06,1.6.0.0.01.01,SERVIÇOS DE COMERCIALIZAÇÃO DE MEDICAMENTOS,"R$ 100.000,00","R$ 59.047,16"
13337,2009-06,1.6.0.0.01.06,"SERVIÇO DE COMERCIALIZAÇÃO DE PRODUTOS, DADOS E MATERIAIS DE INFORMÁTI","R$ 0,00","R$ 0,00"
13349,2009-06,1.6.0.0.02.07,SERVIÇOS DE COMISSÕES PELA PRESTAÇÃO DE SERVIÇOS,"R$ 0,00","-R$ 14,78"
13361,2009-06,1.6.0.0.02.99,OUTROS SERVIÇOS FINANCEIROS,"R$ 471.500,00","R$ 0,00"
13373,2009-06,1.6.0.0.02.99,OUTROS SERVIÇOS FINANCEIROS,"R$ 0,00","R$ 2.492,59"
13385,2009-06,1.6.0.0.02.99,OUTROS SERVIÇOS FINANCEIROS,"R$ 0,00","R$ 16.358,00"
13397,2009-06,1.6.0.0.02.99,OUTROS SERVIÇOS FINANCEIROS,"R$ 0,00","R$ 51.465,23"
13409,2009-06,1.6.0.0.02.99,OUTROS SERVIÇOS FINANCEIROS,"R$ 0,00","R$ 297.095,15"
13421,2009-06,1.6.0.0.03.99,OUTROS SERVIÇOS DE TRANSPORTE,"R$ 1.481.250,00","R$ 1.464.111,05"
13433,2009-06,1.6.0.0.05.01,SERVIÇOS HOSPITALARES - FMS,"R$ 0,00","R$ 0,00"
13445,2009-06,1.6.0.0.05.01,SERVIÇOS HOSPITALARES - FMS,"R$ 0,00","R$ 0,00"
13457,2009-06,1.6.0.0.05.02,SERVIÇOS DE REGISTRO DE ANÁLISE E DE CONTROLE DE PRODUTOS SUJEITOS A N,"R$ 83,33","R$ 0,00"
13469,2009-06,1.6.0.0.05.03,SERVIÇOS RADIOLÓGICOS E LABOARATORIAIS - FMS,"R$ 0,00","R$ 0,00"
13481,2009-06,1.6.0.0.05.03,SERVIÇOS RADIOLÓGICOS E LABOARATORIAIS - FMS,"R$ 0,00","R$ 0,00"
13493,2009-06,1.6.0.0.05.04,SERVIÇOS AMBULATORIAIS - FMS,"R$ 0,00","R$ 0,00"
13505,2009-06,1.6.0.0.05.04,SERVIÇOS AMBULATORIAIS - FMS,"R$ 0,00","R$ 0,00"
13517,2009-06,1.6.0.0.05.99,OUTROS SERVIÇOS DE SAÚDE - FMS,"R$ 0,00","R$ 0,00"
13529,2009-06,1.6.0.0.13.01,SERVIÇOS DE INSCRIÇÃO EM CONCURSOS PÚBLICOS,"R$ 0,00","R$ 0,00"
13541,2009-06,1.6.0.0.13.01,SERVIÇOS DE INSCRIÇÃO EM CONCURSOS PÚBLICOS,"R$ 0,00","R$ 0,00"
13553,2009-06,1.6.0.0.13.01,SERVIÇOS DE INSCRIÇÃO EM CONCURSOS PÚBLICOS,"R$ 0,00","R$ 0,00"
13565,2009-06,1.6.0.0.13.01,SERVIÇOS DE INSCRIÇÃO EM CONCURSOS PÚBLICOS,"R$ 0,00","R$ 0,00"
13577,2009-06,1.6.0.0.13.01,SERVIÇOS DE INSCRIÇÃO EM CONCURSOS PÚBLICOS,"R$ 0,00","R$ 0,00"
13589,2009-06,1.6.0.0.13.01,SERVIÇOS DE INSCRIÇÃO EM CONCURSOS PÚBLICOS,"R$ 0,00","R$ 0,00"
13601,2009-06,1.6.0.0.13.02,SERVIÇOS DE VENDA DE EDITAIS,"R$ 0,00","R$ 0,00"
13613,2009-06,1.6.0.0.13.02,SERVIÇOS DE VENDA DE EDITAIS,"R$ 0,00","R$ 0,00"
13625,2009-06,1.6.0.0.13.02,SERVIÇOS DE VENDA DE EDITAIS,"R$ 0,00","R$ 0,00"
13637,2009-06,1.6.0.0.13.02,SERVIÇOS DE VENDA DE EDITAIS,"R$ 0,00","R$ 0,00"
13649,2009-06,1.6.0.0.13.02,SERVIÇOS DE VENDA DE EDITAIS,"R$ 0,00","R$ 0,00"
13661,2009-06,1.6.0.0.13.02,SERVIÇOS DE VENDA DE EDITAIS,"R$ 0,00","R$ 0,00"
13673,2009-06,1.6.0.0.13.03,SERVIÇOS ADMINISTRATIVOS,"R$ 45.833,33","R$ 34.350,62"
13685,2009-06,1.6.0.0.13.04,SERVIÇOS DE EXPEDIÇÃO DE CERTIFICADOS,"R$ 133.333,33","R$ 94.493,98"
13697,2009-06,1.6.0.0.13.07,SERVIÇOS DE FOTOCÓPIAS OU CÓPIAS HELIOGRÁFICAS,"R$ 0,00","R$ 0,00"
13709,2009-06,1.6.0.0.13.07,SERVIÇOS DE FOTOCÓPIAS OU CÓPIAS HELIOGRÁFICAS,"R$ 0,00","R$ 0,00"
13721,2009-06,1.6.0.0.13.07,SERVIÇOS DE FOTOCÓPIAS OU CÓPIAS HELIOGRÁFICAS,"R$ 0,00","R$ 0,00"
13733,2009-06,1.6.0.0.13.07,SERVIÇOS DE FOTOCÓPIAS OU CÓPIAS HELIOGRÁFICAS,"R$ 0,00","R$ 0,00"
13745,2009-06,1.6.0.0.13.07,SERVIÇOS DE FOTOCÓPIAS OU CÓPIAS HELIOGRÁFICAS,"R$ 0,00","R$ 0,00"
13757,2009-06,1.6.0.0.13.07,SERVIÇOS DE FOTOCÓPIAS OU CÓPIAS HELIOGRÁFICAS,"R$ 0,00","R$ 0,00"
13769,2009-06,1.6.0.0.13.08,SERVIÇOS DE EXPEDIENTES,"R$ 8,33","R$ 0,00"
13781,2009-06,1.6.0.0.13.08,SERVIÇOS DE EXPEDIENTES,"R$ 8,33","R$ 0,00"
13793,2009-06,1.6.0.0.13.11,REQUISIÇÃO DE SERVIÇOS - FISC,"R$ 0,00","R$ 0,00"
13805,2009-06,1.6.0.0.13.12,REMOÇÃO E ESTADIA - DSV,"R$ 1.416.666,67","R$ 0,00"
13817,2009-06,1.6.0.0.13.13,AUTUAÇÃO DE PROCESSOS - DAMSP,"R$ 125.000,00","R$ 154.816,30"
13829,2009-06,1.6.0.0.13.14,AUTUAÇÃO DE PROCESSOS - G. A. 99-T,"R$ 15.000,00","R$ 15.230,20"
13841,2009-06,1.6.0.0.13.15,"ANÁLISE DE ESTUDOS, PLANOS, PROJETOS E RELATÓRIOS - DECONT","R$ 0,00","R$ 0,00"
13853,2009-06,1.6.0.0.13.16,"DESINTERDIÇÃO, FISCALIZAÇÃO E VISTORIA - DECONT","R$ 1.666,67","R$ 1.211,70"
13865,2009-06,1.6.0.0.13.17,EMISSÃO DE LICENÇAS AMBIENTAIS - DECONT,"R$ 0,00","R$ 0,00"
13877,2009-06,1.6.0.0.13.18,SERVIÇOS DE TRANSPORTE DO DTP,"R$ 1.000.000,00","R$ 769.055,19"
13889,2009-06,1.6.0.0.13.19,RECEITA DE REGISTROS DE PROFISSIONAIS E FIRMAS,"R$ 5.000,00","R$ 3.191,80"
13901,2009-06,1.6.0.0.13.20,TERMO DE PERMISSÃO DE USO - TPU,"R$ 416.666,67","R$ 553.715,44"
13913,2009-06,1.6.0.0.13.23,LICENÇA ESPECIAL DE TRÂNSITO DE PRODUTOS PERIGOSOS - SMT,"R$ 3.333,33","R$ 143,10"
13925,2009-06,1.6.0.0.13.24,PANFLETAGEM - PROGRAMAS SOCIAIS - PMSP,"R$ 0,00","R$ 0,00"
13937,2009-06,1.6.0.0.13.25,CADASTRAMENTO DE AMBULANTES,"R$ 0,00","R$ 0,00"
13949,2009-06,1.6.0.0.13.26,TERMO DE PERMISSÃO DE USO - CONVIAS,"R$ 10.000,00","R$ 9.390,30"
13961,2009-06,1.6.0.0.13.27,APROVAÇÃO DE PROJETOS - CONVIAS,"R$ 26.666,67","R$ 26.370,60"
13973,2009-06,1.6.0.0.13.99,OUTROS SERVIÇOS ADMINISTRATIVOS,"R$ 0,00","R$ 112,30"
13985,2009-06,1.6.0.0.13.99,OUTROS SERVIÇOS ADMINISTRATIVOS,"R$ 58,33","R$ 54,10"
13997,2009-06,1.6.0.0.13.99,OUTROS SERVIÇOS ADMINISTRATIVOS,"R$ 0,00","R$ 0,00"
14009,2009-06,1.6.0.0.13.99,OUTROS SERVIÇOS ADMINISTRATIVOS,"R$ 67.500,00","R$ 109.384,41"
14021,2009-06,1.6.0.0.13.99,OUTROS SERVIÇOS ADMINISTRATIVOS,"R$ 0,00","R$ 0,00"
14033,2009-06,1.6.0.0.14.01,SERVIÇOS DE INSPEÇÃO E FISCALIZAÇÃO,"R$ 145.833,33","R$ 66.970,54"
14045,2009-06,1.6.0.0.19.01,SERVIÇOS RECREATIVOS E CULTURAIS,"R$ 0,00","R$ 0,00"
14057,2009-06,1.6.0.0.19.01,SERVIÇOS RECREATIVOS E CULTURAIS,"R$ 0,00","R$ 0,00"
14069,2009-06,1.6.0.0.21.01,FORNECIMENTO DE REFEIÇÕES,"R$ 0,00","R$ 2.139,95"
14081,2009-06,1.6.0.0.28,SERVIÇOS DE GEOPROCESSAMENTO,"R$ 0,00","R$ 0,00"
14093,2009-06,1.6.0.0.43.01,COLETA DE RESÍDUOS SÓLIDOS - SAÚDE - LIMPURB,"R$ 583.333,33","R$ 448.181,70"
14105,2009-06,1.6.0.0.99.01,CONCESSÕES,"R$ 2.158.333,33","R$ 777.499,70"
14117,2009-06,1.6.0.0.99.02,OUTROS SERVIÇOS DE CEMITÉRIOS,"R$ 269.166,67","R$ 296.568,10"
14129,2009-06,1.6.0.0.99.03,COMERCIALIZAÇÃO DE URNAS E CAIXÕES,"R$ 3.170.833,33","R$ 3.286.290,43"
14141,2009-06,1.6.0.0.99.04,COMERCIALIZAÇÃO DE URNAS PARA CINZAS DE MADEIRA E COBRE,"R$ 6.666,67","R$ 13.618,10"
14153,2009-06,1.6.0.0.99.05,COMERCIALIZAÇÃO DE ARTIGOS RELIGIOSOS,"R$ 59.166,67","R$ 72.796,90"
14165,2009-06,1.6.0.0.99.06,COMERCIALIZAÇÃO DE FLORES,"R$ 552.500,00","R$ 482.070,55"
14177,2009-06,1.6.0.0.99.07,SEPULTAMENTO,"R$ 535.000,00","R$ 469.684,82"
14189,2009-06,1.6.0.0.99.08,ALUGUEL DE GAVETA,"R$ 43.333,33","R$ 34.971,55"
14201,2009-06,1.6.0.0.99.09,ALUGUEL QUADRA GERAL,"R$ 88.333,33","R$ 115.365,00"
14213,2009-06,1.6.0.0.99.10,COLUMBÁRIO,"R$ 4.583,33","R$ 6.825,25"
14225,2009-06,1.6.0.0.99.11,VELÓRIO,"R$ 633.333,33","R$ 571.171,22"
14237,2009-06,1.6.0.0.99.12,CREMAÇÃO,"R$ 234.166,67","R$ 264.886,60"
14249,2009-06,1.6.0.0.99.13,CÂMARA FRIGORÍFICA,"R$ 22.333,33","R$ 23.747,50"
14261,2009-06,1.6.0.0.99.14,ESSA,"R$ 186.666,67","R$ 211.463,80"
14273,2009-06,1.6.0.0.99.15,OZONA,"R$ 416,67","R$ 0,00"
14285,2009-06,1.6.0.0.99.16,MESA,"R$ 34.166,67","R$ 38.600,50"
14297,2009-06,1.6.0.0.99.17,COMERCIALIZAÇÃO DE URNAS PARA CINZAS - FRASQUEIRAS,"R$ 4.750,00","R$ 644,00"
14309,2009-06,1.6.0.0.99.18,COMERCIALIZAÇÃO DE VELAS E LÂMPADAS,"R$ 67.500,00","R$ 70.000,17"
14321,2009-06,1.6.0.0.99.19,OUTROS SERVIÇOS,"R$ 421.250,00","R$ 6.373,82"
14333,2009-06,1.6.0.0.99.19,OUTROS SERVIÇOS,"R$ 421.250,00","R$ 4.526,41"
14345,2009-06,1.7.2.1.01.02,COTA-PARTE DO FUNDO DE PARTICIPAÇÃO DOS MUNICÍPIOS,"R$ 11.666.666,67","R$ 10.103.592,55"
14357,2009-06,1.7.2.1.01.05,COTA-PARTE DO IMPOSTO S/ A PROPRIEDADE TERRITORIAL RURAL,"R$ 166.666,67","R$ 15.964,74"
14369,2009-06,1.7.2.1.01.32,"COTA-PARTE DO IMPOSTO S/ OPERAÇÕES DE CRÉDITO, CÂMBIO E SEGURO, OU REL","R$ 5.833,33","R$ 7.327,55"
14381,2009-06,1.7.2.1.22.11,COTA-PARTE DA COMPENSAÇÃO FINANCEIRA DE RECURSOS HÍDRICOS,"R$ 33.333,33","R$ 46.495,78"
14393,2009-06,1.7.2.1.22.20,COTA-PARTE DA COMPENSAÇÃO FINANCEIRA DE EXTRAÇÃO MINERAL - CFEM,"R$ 31.666,67","R$ 60.265,36"
