id,data,codigo,descricao,previsto_mensal,realizado_mensal
10093,2008-02,8.4.2.3.99.01,CONTRIBUIÇÕES DA PMSP - INTRA-ORÇAMENTÁRIA,"R$ 0,00","R$ 0,00"
10105,2008-02,8.4.2.3.99.01,CONTRIBUIÇÕES DA PMSP - INTRA-ORÇAMENTÁRIA,"R$ 0,00","R$ 0,00"
10117,2008-02,8.4.2.3.99.01,CONTRIBUIÇÕES DA PMSP - INTRA-ORÇAMENTÁRIA,"R$ 0,00","R$ 0,00"
10129,2008-02,8.4.2.3.99.01,CONTRIBUIÇÕES DA PMSP - INTRA-ORÇAMENTÁRIA,"R$ 0,00","R$ 0,00"
10141,2008-02,8.4.2.3.99.01,CONTRIBUIÇÕES DA PMSP - INTRA-ORÇAMENTÁRIA,"R$ 0,00","R$ 0,00"
10153,2008-02,8.4.2.3.99.01,CONTRIBUIÇÕES DA PMSP - INTRA-ORÇAMENTÁRIA,"R$ 0,00","R$ 0,00"
10165,2008-02,8.4.2.3.99.01,CONTRIBUIÇÕES DA PMSP - INTRA-ORÇAMENTÁRIA,"R$ 0,00","R$ 0,00"
10177,2008-02,8.4.2.3.99.01,CONTRIBUIÇÕES DA PMSP - INTRA-ORÇAMENTÁRIA,"R$ 0,00","R$ 0,00"
10189,2008-02,8.4.2.3.99.01,CONTRIBUIÇÕES DA PMSP - INTRA-ORÇAMENTÁRIA,"R$ 0,00","R$ 0,00"
10201,2008-02,9.1.1.2.02.01,DEDUÇÕES DO IMPOSTO S/ A PROPRIEDADE PREDIAL,"R$ 0,00","R$ 0,00"
10213,2008-02,9.1.1.2.02.02,DEDUÇÕES DO IMPOSTO S/ A PROPRIEDADE TERRITORIAL URBANA,"R$ 0,00","R$ 0,00"
10225,2008-02,9.1.1.2.04.31,DEDUÇÕES DO IMPOSTO DE RENDA RETIDO NAS FONTES S/ OS RENDIMENTOS DO TR,"R$ 0,00","-R$ 12.001,23"
10237,2008-02,9.1.1.2.04.33,DEDUÇÕES DO IMPOSTO DE RENDA RETIDO NAS FONTES S/ REMESSA DE RECURSOS,"R$ 0,00","R$ 0,00"
10249,2008-02,9.1.1.2.04.34,DEDUÇÕES DO IMPOSTO DE RENDA RETIDO NAS FONTES S/ OUTROS RENDIMENTOS,"R$ 0,00","R$ 0,00"
10261,2008-02,9.1.1.2.08.01,DEDUÇÕES DO IMPOSTO S/ TRANSMISSÃO  INTER-VIVOS  DE BENS IMÓVEIS E DE,"R$ 0,00","-R$ 1.087,93"
10273,2008-02,9.1.1.3.05.01,DEDUÇÕES DO ISS,"R$ 0,00","-R$ 407.347,51"
10285,2008-02,9.1.1.3.05.02,DEDUÇÕES DO ISS - SISTEMA INTEGRADO - SIMPLES,"R$ 0,00","R$ 0,00"
10297,2008-02,9.1.1.3.05.03,DEDUÇÕES DO ISS - CMSP,"R$ 0,00","R$ 0,00"
10309,2008-02,9.1.1.3.07,DEDUÇÕES DO IMPOSTO S/ A VENDA A VAREJO DE COMBUSTÍVEIS LÍQUIDOS E GAS,"R$ 0,00","R$ 0,00"
10321,2008-02,9.1.2.1.25.01,"DEDUÇÕES DA TAXA DE LICENÇA P/LOCALIZAÇÃO, INSTALAÇÃO E FUNCIONAMENTO","R$ 0,00","R$ 0,00"
10333,2008-02,9.1.2.1.25.02,DEDUÇÕES DA TAXA DE VISTORIA DE NORMAS DE SEGURANÇA,"R$ 0,00","R$ 0,00"
10345,2008-02,9.1.2.1.25.03,DEDUÇÕES DA TAXA DE FISCALIZAÇÃO DE ESTABELECIMENTOS - TFE,"R$ 0,00","-R$ 1.953,01"
10357,2008-02,9.1.2.1.26.01,DEDUÇÕES DA TAXA DE FISCALIZAÇÃO DE ANÚNCIOS,"R$ 0,00","R$ 0,00"
10369,2008-02,9.1.2.1.32.01,DEDUÇÕES DA TAXA P/ EXAME E VERIFICAÇÃO DE PROJETOS E CONSTRUÇÕES,"R$ 0,00","-R$ 41.315,14"
10381,2008-02,9.1.2.1.34.01,DEDUÇÕES DA TAXA DE VISTORIA DE APARELHOS DE TRANSPORTE VERTICAL E HOR,"R$ 0,00","R$ 0,00"
10393,2008-02,9.1.2.1.99.01,DEDUÇÕES DA TAXA DE LICENÇA P/ TRÁFEGO DE VEÍCULOS,"R$ 0,00","R$ 0,00"
10405,2008-02,9.1.2.1.99.02,DEDUÇÕES DA TAXA DE LICENÇA P/ ARRUAMENTOS E LOTEAMENTOS,"R$ 0,00","R$ 0,00"
10417,2008-02,9.1.2.1.99.03,DEDUÇÕES DA TAXA DE FISCALIZAÇÃO DOS SERVIÇOS DE LIMPEZA URBANA - FISL,"R$ 0,00","R$ 0,00"
10429,2008-02,9.1.2.1.99.04,DEDUÇÕES DA TAXA DE REMOÇÃO - CET,"R$ 0,00","R$ 0,00"
10441,2008-02,9.1.2.2.90.01,DEDUÇÕES DA TAXA DE LIMPEZA PÚBLICA,"R$ 0,00","R$ 0,00"
10453,2008-02,9.1.2.2.90.02,DEDUÇÕES DA TAXA DE RESÍDUOS SÓLIDOS DOMICILARES - TRSD,"R$ 0,00","R$ 0,00"
10465,2008-02,9.1.2.2.90.03,DEDUÇÕES DA TAXA DE RESÍDUOS SÓLIDOS DE SERVIÇOS DE SAÚDE - TRSS,"R$ 0,00","R$ 0,00"
10477,2008-02,9.1.2.2.99.01,DEDUÇÕES DA TAXA DE CONSERVAÇÃO DE VIAS E LOGRADOUROS PÚBLICOS,"R$ 0,00","R$ 0,00"
10489,2008-02,9.1.2.2.99.02,DEDUÇÕES DA TAXA DE ESTUDOS P/ FIXAÇÃO DE DIRETRIZES,"R$ 0,00","R$ 0,00"
10501,2008-02,9.1.2.2.99.03,DEDUÇÕES DA TAXA DE COMBATE A SINISTROS,"R$ 0,00","R$ 0,00"
10513,2008-02,9.1.3.0.00.01,DEDUÇÕES DA CONTRIBUIÇÃO DE MELHORIA,"R$ 0,00","R$ 0,00"
10525,2008-02,9.1.5,DEDUÇÕES DAS RECEITAS A CLASSIFICAR - DAMSP,"R$ 0,00","R$ 0,00"
10537,2008-02,9.2.2.0.29,DEDUÇÕES DA CONTRIBUIÇÃO P/ O CUSTEIO DO SERVIÇO D,"R$ 0,00","R$ 0,00"
10549,2008-02,9.3.2.5.01.03,DEDUÇÕES DA RECEITA DE REMUNERAÇÃO DE DEPÓSITOS BANCÁRIOS DE RECURSOS,"R$ 0,00","R$ 0,00"
10561,2008-02,9.3.2.6.00.02,DEDUÇÃO DO CONVÊNIO PMSP/SDTS - PLANTEQ/2004 - FAT,"R$ 0,00","R$ 0,00"
10573,2008-02,9.3.2.6.00.03,DEDUÇÕES DO CONVÊNIO MTE/SPPE/CODEFAT,"R$ 0,00","R$ 0,00"
10585,2008-02,9.3.2.9.01.01,DEDUÇÕES PMSP,"R$ 0,00","-R$ 1.370,40"
10597,2008-02,9.3.2.9.01.06,DEDUÇÕES DAS OPERAÇÕES INTERLIGADAS,"R$ 0,00","R$ 0,00"
10609,2008-02,9.3.2.9.01.10,DEDUÇÕES DO PROGRAMA NACIONAL DE ALIMENTAÇÃO ESCOLAR - PNAE/FNDE,"R$ 0,00","R$ 0,00"
10621,2008-02,9.3.2.9.01.16,DEDUÇÕES DOS PROJETOS MUNICIPAIS DE EXPANSÃO DA SAÚDE DA FAMÍLIA - PRO,"R$ 0,00","R$ 0,00"
10633,2008-02,9.3.2.9.01.36,DEDUÇÕES DA PROTEÇÃO SOCIAL BÁSICA/FMAS,"R$ 0,00","R$ 0,00"
10645,2008-02,9.3.2.9.01.37,DEDUÇÕES DA PROTEÇÃO SOCIAL ESPECIAL/FMAS,"R$ 0,00","R$ 0,00"
10657,2008-02,9.3.2.9.01.41,DEDUÇÕES DA PMSP/ SAS/ FMAS,"R$ 0,00","R$ 0,00"
10669,2008-02,9.3.2.9.01.42,DEDUÇÕES DO CONVÊNIO MEC/FNDE - ASSISTÊNCIA FINANCEIRA A PROGRAMAS E P,"R$ 0,00","R$ 0,00"
10681,2008-02,9.3.2.9.01.43,DEDUÇÃO RADIAL LESTE,"R$ 0,00","R$ 0,00"
10693,2008-02,9.3.2.9.01.50,DEDUÇÕES DA SECRETARIA DE ESTADO DA SAÚDE - SMS/FMS,"R$ 0,00","R$ 0,00"
10705,2008-02,9.3.2.9.01.58,DEDUÇÕES DO FMAS - FUNDO MUNICIPAL DE ASSISTÊNCIA SOCIAL,"R$ 0,00","R$ 0,00"
10717,2008-02,9.3.2.9.01.68,DEDUÇÕES DO CONVÊNIO MTE/SPPE X PMSP/SMTRAB -  PRO,"R$ 0,00","R$ 0,00"
10729,2008-02,9.3.2.9.01.79,DEDUÇÕES DO CONVÊNIO SME X ESTADO,"R$ 0,00","R$ 0,00"
10741,2008-02,9.3.3.9.99.02,"DEDUÇÕES DAS RENDAS DE MERCADOS, FEIRAS E FRIGORIFICOS (ANT.MAT.) - SI","R$ 0,00","R$ 0,00"
10753,2008-02,9.3.9.0.01.01,DEDUÇÕES DE REMUNERAÇÕES DIVERSAS,"R$ 0,00","R$ 0,00"
10765,2008-02,9.6.0.0.13.08,DEDUÇÕES DE SERVIÇOS DE EXPEDIENTES,"R$ 0,00","R$ 0,00"
10777,2008-02,9.6.0.0.13.12,DEDUÇÕES DE REMOÇÃO E ESTADIA - DSV,"R$ 0,00","R$ 0,00"
10789,2008-02,9.6.0.0.13.14,DEDUÇÕES DE AUTUAÇÃO DE PROCESSOS - G. A. 99-T,"R$ 0,00","R$ 0,00"
10801,2008-02,9.6.0.0.13.18,DEDUÇÕES DE SERVIÇOS DE TRANSPORTE DO DTP,"R$ 0,00","R$ 0,00"
10813,2008-02,9.6.0.0.13.20,DEDUÇÕES DO TERMO DE PERMISSÃO DE USO - TPU,"R$ 0,00","R$ 0,00"
10825,2008-02,9.6.0.0.13.24,DEDUÇÕES DE PANFLETAGEM - PROGRAMAS SOCIAIS - PMSP,"R$ 0,00","R$ 0,00"
10837,2008-02,9.6.0.0.43.01,DEDUÇÕES DA COLETA DE RESÍDUOS SÓLIDOS - SAÚDE - LIMPURB,"R$ 0,00","R$ 0,00"
10849,2008-02,9.7.2.1.01.02,DEDUÇÃO DE RECEITA DO FPM - FUNDEB E REDUTOR FINANCEIRO (CORRESP. 1721,"-R$ 1.943.743,75","-R$ 2.048.147,59"
10861,2008-02,9.7.2.1.01.05,DEDUÇÃO DE RECEITA PARA A FORMAÇÃO DO FUNDEB - ITR (CORRESP. 1721.01.0,"-R$ 7.553,67","-R$ 7.521,79"
10873,2008-02,9.7.2.1.36,DEDUÇÃO DE RECEITA PARA FORMAÇÃO DO FUNDEB - ICMS DESONERAÇÃO - LEI CO,"-R$ 594.755,25","R$ 0,00"
10885,2008-02,9.7.2.2.01.01,DEDUÇÃO DE RECEITA PARA A FORMAÇÃO DO FUNDEB - ICMS (CORRESP. 1722.01.,"-R$ 63.284.325,00","-R$ 59.365.379,22"
10897,2008-02,9.7.2.2.01.02,DEDUÇÃO DE RECEITA PARA A FORMAÇÃO DO FUNDEB - IPVA (CORRESP. 1722.01.,"-R$ 17.273.458,33","-R$ 38.235.777,23"
10909,2008-02,9.7.2.2.01.04,DEDUÇÃO DE RECEITA PARA A FORMAÇÃO DO FUNDEB - IPI - EXPORTAÇÃO (CORRE,"-R$ 589.615,00","-R$ 625.472,35"
10921,2008-02,9.7.6.1.03.01,DEDUÇÕES PMSP/SAS/FMAS,"R$ 0,00","R$ 0,00"
10933,2008-02,9.7.6.1.99.13,DEDUÇÕES DA PMSP/SDTS - PLANSINE - FAT,"R$ 0,00","R$ 0,00"
10945,2008-02,9.7.6.1.99.20,DEDUÇÕES DO CONVÊNIO MTE/SPPE/CODEFAT,"R$ 0,00","R$ 0,00"
10957,2008-02,9.9.1.1.40.01,DEDUÇÕES DAS MULTAS E JUROS DE MORA DO IMPOSTO S/,"R$ 0,00","R$ 0,00"
10969,2008-02,9.9.1.9.11.02,DEDUÇÕES DAS MULTAS SMSP - SISTEMA NOVO,"R$ 0,00","R$ 0,00"
10981,2008-02,9.9.1.9.15.01,DEDUÇÕES DE MULTAS DE TRÂNSITO - DSV - FMDT,"R$ 0,00","-R$ 11.922,26"
10993,2008-02,9.9.1.9.27.02,DEDUÇÕES DAS MULTAS E JUROS/CONTRATOS PMSP,"R$ 0,00","-R$ 20.516,14"
11005,2008-02,9.9.1.9.99.01,DEDUÇÕES DE MULTAS E JUROS DIVERSOS - PMSP,"R$ 0,00","R$ 0,00"
11017,2008-02,9.9.2.2.99.01,DEDUÇÕES DE RESTITUIÇÕES DIVERSAS,"R$ 0,00","R$ 0,00"
11029,2008-02,9.9.3.1.99.01,DEDUÇÕES DA RECEITA DA DÍVIDA ATIVA DE OUTROS TRIBUTOS - PRINCIPAL - P,"R$ 0,00","R$ 0,00"
11041,2008-02,9.9.3.1.99.03,DEDUÇÕES DE FISC,"R$ 0,00","R$ 0,00"
11053,2008-02,9.9.9.0.01.01,DEDUÇÕES DO REFIS,"R$ 0,00","-R$ 20.356,09"
11065,2008-02,9.9.9.0.01.02,DEDUÇÕES DO PROGRAMA DE PARCELAMENTO INCENTIVADO - PPI,"R$ 0,00","R$ 0,00"
11077,2008-02,9.9.9.0.02.01,DEDUÇÕES DA RECEITA DE HONORÁRIOS DE ADVOGADOS,"R$ 0,00","R$ 0,00"
11089,2008-02,9.9.9.0.99.04,DEDUÇÕES DE TARIFA BANCÁRIA,"R$ 0,00","R$ 0,00"
11101,2008-02,9.9.9.0.99.22,DEDUÇÕES DE EVENTUAIS DIVERSOS - PMSP,"R$ 0,00","-R$ 29.161,73"
11113,2008-02,9.9.9.0.99.23,DEDUÇÕES DOS LEILÕES - DSV/SPTRANS/CET,"R$ 0,00","R$ 0,00"
