id,data,codigo,descricao,previsto_mensal,realizado_mensal
1,2008-02,1.1.1.2.02.01,IMPOSTO S/ A PROPRIEDADE PREDIAL,"R$ 235.916.333,33","R$ 825.577.756,80"
13,2008-02,1.1.1.2.02.02,IMPOSTO S/ A PROPRIEDADE TERRITORIAL URBANA,"R$ 11.130.250,00","R$ 41.884.378,39"
25,2008-02,1.1.1.2.04.31,IMPOSTO DE RENDA RETIDO NAS FONTES S/ OS RENDIMENTOS DO TRABALHO,"R$ 47.250.000,00","R$ 46.982.481,96"
37,2008-02,1.1.1.2.04.33,IMPOSTO DE RENDA RETIDO NAS FONTES S/ REMESSA DE RECURSOS AO EXTERIOR,"R$ 0,00","R$ 0,00"
49,2008-02,1.1.1.2.04.34,IMPOSTO DE RENDA RETIDO NAS FONTES S/ OUTROS RENDIMENTOS,"R$ 8.750.000,00","R$ 8.136.504,22"
61,2008-02,1.1.1.2.08,IMPOSTO S/ TRANSMISSÃO  INTER-VIVOS  DE BENS IMÓVE,"R$ 45.620.833,33","R$ 44.986.284,91"
73,2008-02,1.1.1.3.05.01,IMPOSTO SOBRE SERVIÇOS DE QUALQUER NATUREZA,"R$ 410.000.000,00","R$ 377.723.803,47"
85,2008-02,1.1.1.3.05.02,ISS - SISTEMA INTEGRADO - SIMPLES,"R$ 791.666,67","R$ 158.864,05"
97,2008-02,1.1.1.3.05.03,ISS - CMSP,"R$ 17.916,67","R$ 0,00"
109,2008-02,1.1.1.3.05.04,ISS - SIMPLES NACIONAL,"R$ 24.066.666,67","R$ 22.543.414,72"
121,2008-02,1.1.1.3.07,IMPOSTO S/ VENDA A VAREJO DE COMBUSTÍVEIS LÍQUIDOS E GASOSOS - IVV,"R$ 0,00","R$ 0,00"
133,2008-02,1.1.2.1.25.01,"TAXA DE LICENÇA P/ LOCALIZAÇÃO, INSTALAÇÃO E FUNCIONAMENTO","R$ 0,00","R$ 0,00"
145,2008-02,1.1.2.1.25.02,TAXA DE VISTORIA DE NORMAS DE SEGURANÇA,"R$ 0,00","R$ 0,00"
157,2008-02,1.1.2.1.25.03,TAXA DE FISCALIZAÇÃO DE ESTABELECIMENTOS - TFE,"R$ 6.916.666,67","R$ 933.078,79"
169,2008-02,1.1.2.1.26.01,TAXA DE FISCALIZAÇÃO DE ANÚNCIOS,"R$ 1.250.000,00","R$ 210.556,20"
181,2008-02,1.1.2.1.32.01,TAXA P/ EXAME E VERIFICAÇÃO DE  PROJETOS E CONSTRUÇÕES,"R$ 4.333.333,33","R$ 3.185.104,40"
193,2008-02,1.1.2.1.34.01,TAXA DE VISTORIA DE APARELHOS DE TRANSPORTE VERTICAL E HORIZONTAL,"R$ 566.666,67","R$ 8.634,78"
205,2008-02,1.1.2.1.99.01,TAXA DE LICENÇA P/ TRÁFEGO DE VEÍCULOS,"R$ 15.000,00","R$ 0,00"
217,2008-02,1.1.2.1.99.02,TAXA DE LICENÇA P/ ARRUAMENTOS E LOTEAMENTOS,"R$ 0,00","R$ 0,00"
229,2008-02,1.1.2.1.99.03,TAXA DE FISCALIZAÇÃO DOS SERVIÇOS DE LIMPEZA URBANA - FISLURB,"R$ 140.833,33","R$ 11.547,67"
241,2008-02,1.1.2.1.99.04,TAXA DE REMOÇÃO - CET,"R$ 75.833,33","R$ 19.529,60"
253,2008-02,1.1.2.1.99.05,TAXA DE FISCALIZAÇÃO DE CEMITÉRIOS,"R$ 75.000,00","R$ 76.330,69"
265,2008-02,1.1.2.2.90.01,TAXA DE LIMPEZA PÚBLICA,"R$ 3.750,00","R$ 2.200,78"
277,2008-02,1.1.2.2.90.02,TAXA DE RESÍDUOS SÓLIDOS DOMICILIARES - TRSD,"R$ 1.368.333,33","R$ 557.060,67"
289,2008-02,1.1.2.2.90.03,TAXA DE RESÍDUOS SÓLIDOS DE SERVIÇOS DE SAÚDE - TRSS,"R$ 7.083.333,33","R$ 1.489.674,32"
301,2008-02,1.1.2.2.99.01,TAXA DE CONSERVAÇÃO DE VIAS E LOGRADOUROS PÚBLICOS,"R$ 333,33","R$ 493,46"
313,2008-02,1.1.2.2.99.02,TAXA DE ESTUDOS P/ FIXAÇÃO DE DIRETRIZES,"R$ 20.833,33","R$ 82.437,69"
325,2008-02,1.1.2.2.99.03,TAXA DE COMBATE A SINISTROS,"R$ 5.833,33","R$ 5.740,21"
337,2008-02,1.1.3.0.00.01,CONTRIBUIÇÃO DE MELHORIA,"R$ 13.416,67","R$ 1.231,64"
349,2008-02,1.1.4,RECEITA TRIBUTÁRIA A CLASSIFICAR,"R$ 0,00","R$ 499.169,03"
361,2008-02,1.1.5,RECEITAS A CLASSIFICAR - DAMSP,"R$ 0,00","R$ 539.540,48"
373,2008-02,1.2.1.0.01.01,PMSP,"R$ 7.333.066,67","R$ 6.702.443,96"
385,2008-02,1.2.1.0.01.02,CÂMARA MUNICIPAL,"R$ 37.187,50","R$ 0,00"
397,2008-02,1.2.1.0.01.03,TRIBUNAL DE CONTAS DO MUNICÍPIO DE SÃO PAULO,"R$ 19.055,42","R$ 0,00"
409,2008-02,1.2.1.0.01.04,IPREM,"R$ 9.450,00","R$ 0,00"
421,2008-02,1.2.1.0.01.05,PENSIONISTAS - IPREM,"R$ 376.657,08","R$ 0,00"
433,2008-02,1.2.1.0.01.06,SERVIÇO FUNERÁRIO DE SÃO PAULO,"R$ 31.850,00","R$ 0,00"
445,2008-02,1.2.1.0.01.07,CONTRIBUIÇÃO PESSOAL HSPM/CLT,"R$ 50.400,00","R$ 0,00"
457,2008-02,1.2.1.0.29.01,CONTRIBUIÇÃO PATRONAL DE SERVIDOR ATIVO CIVIL PARA,"R$ 0,00","R$ 0,00"
469,2008-02,1.2.1.0.29.01,CONTRIBUIÇÃO PATRONAL DE SERVIDOR ATIVO CIVIL PARA,"R$ 0,00","R$ 53.232,40"
481,2008-02,1.2.1.0.29.07,CONTRIBUIÇÃO DO SERVIDOR ATIVO CIVIL PARA O REGIME,"R$ 44.280.609,67","R$ 0,00"
493,2008-02,1.2.1.0.29.07,CONTRIBUIÇÃO DO SERVIDOR ATIVO CIVIL PARA O REGIME,"R$ 0,00","R$ 30.576.976,37"
505,2008-02,1.2.1.0.29.07,CONTRIBUIÇÃO DO SERVIDOR ATIVO CIVIL PARA O REGIME,"R$ 0,00","R$ 352.811,39"
517,2008-02,1.2.1.0.29.07,CONTRIBUIÇÃO DO SERVIDOR ATIVO CIVIL PARA O REGIME,"R$ 0,00","R$ 440.925,16"
529,2008-02,1.2.1.0.29.07,CONTRIBUIÇÃO DO SERVIDOR ATIVO CIVIL PARA O REGIME,"R$ 0,00","R$ 10.056,41"
541,2008-02,1.2.1.0.29.07,CONTRIBUIÇÃO DO SERVIDOR ATIVO CIVIL PARA O REGIME,"R$ 0,00","R$ 180.622,58"
553,2008-02,1.2.1.0.29.07,CONTRIBUIÇÃO DO SERVIDOR ATIVO CIVIL PARA O REGIME,"R$ 0,00","R$ 0,00"
565,2008-02,1.2.1.0.29.07,CONTRIBUIÇÃO DO SERVIDOR ATIVO CIVIL PARA O REGIME,"R$ 0,00","R$ 0,00"
577,2008-02,1.2.1.0.29.07,CONTRIBUIÇÃO DO SERVIDOR ATIVO CIVIL PARA O REGIME,"R$ 0,00","R$ 0,00"
589,2008-02,1.2.1.0.29.07,CONTRIBUIÇÃO DO SERVIDOR ATIVO CIVIL PARA O REGIME,"R$ 0,00","R$ 0,00"
601,2008-02,1.2.1.0.29.07,CONTRIBUIÇÃO DO SERVIDOR ATIVO CIVIL PARA O REGIME,"R$ 0,00","R$ 110.828,62"
613,2008-02,1.2.1.0.29.07,CONTRIBUIÇÃO DO SERVIDOR ATIVO CIVIL PARA O REGIME,"R$ 0,00","R$ 61.528,26"
625,2008-02,1.2.1.0.29.07,CONTRIBUIÇÃO DO SERVIDOR ATIVO CIVIL PARA O REGIME,"R$ 0,00","R$ 24.401,56"
637,2008-02,1.2.1.0.29.09,CONTRIBUIÇÕES DO SERVIDOR INATIVO CIVIL PARA O REG,"R$ 5.819.000,00","R$ 0,00"
649,2008-02,1.2.1.0.29.09,CONTRIBUIÇÕES DO SERVIDOR INATIVO CIVIL PARA O REG,"R$ 0,00","R$ 4.960.143,45"
661,2008-02,1.2.1.0.29.09,CONTRIBUIÇÕES DO SERVIDOR INATIVO CIVIL PARA O REG,"R$ 0,00","R$ 400.314,21"
673,2008-02,1.2.1.0.29.09,CONTRIBUIÇÕES DO SERVIDOR INATIVO CIVIL PARA O REG,"R$ 0,00","R$ 179.235,63"
685,2008-02,1.2.1.0.29.09,CONTRIBUIÇÕES DO SERVIDOR INATIVO CIVIL PARA O REG,"R$ 0,00","R$ 3.863,23"
697,2008-02,1.2.1.0.29.09,CONTRIBUIÇÕES DO SERVIDOR INATIVO CIVIL PARA O REG,"R$ 0,00","R$ 35.833,02"
709,2008-02,1.2.1.0.29.11,CONTRIBUIÇÕES DE PENSIONISTA CIVIL PARA O REGIME P,"R$ 916.666,67","R$ 0,00"
721,2008-02,1.2.1.0.29.11,CONTRIBUIÇÕES DE PENSIONISTA CIVIL PARA O REGIME P,"R$ 0,00","R$ 896.412,25"
733,2008-02,1.2.1.0.46.01,COMPENSAÇÃO PREVID. ENTRE RGPS E OS RPPS,"R$ 0,00","R$ 0,00"
745,2008-02,1.2.2.0.29,CONTRIBUIÇÃO P/ O CUSTEIO DO SERVIÇO DE ILUMINAÇÃO,"R$ 15.291.666,67","R$ 15.598.602,95"
757,2008-02,1.3.1.1.99,OUTRAS RECEITAS DE ALUGUÉIS,"R$ 19.166,67","R$ 18.952,14"
769,2008-02,1.3.1.1.99,OUTRAS RECEITAS DE ALUGUÉIS,"R$ 19.166,67","R$ 18.952,14"
781,2008-02,1.3.1.9.01.01,OUTRAS RECEITAS IMOBILIARIAS,"R$ 0,00","R$ 0,00"
793,2008-02,1.3.1.9.01.01,OUTRAS RECEITAS IMOBILIARIAS,"R$ 0,00","R$ 0,00"
805,2008-02,1.3.2.3,PARTICIPAÇÕES,"R$ 0,00","R$ 0,00"
817,2008-02,1.3.2.5.01.01,RECEITA DE REMUNERAÇÃO DE DEPÓSITOS BANCÁRIOS DE RECURSOS VINCULADOS -,"R$ 0,00","R$ 0,00"
829,2008-02,1.3.2.5.01.02,RECEITA DE REMUNERAÇÃO DE DEPÓSITOS BANCÁRIOS DE RECURSOS VINCULADOS -,"R$ 2.620.166,67","R$ 1.494.084,52"
841,2008-02,1.3.2.5.01.03,RECEITA DE REMUNERAÇÃO DE DEPÓSITOS BANCÁRIOS DE RECURSOS VINCULADOS -,"R$ 0,00","R$ 0,00"
853,2008-02,1.3.2.5.01.03,RECEITA DE REMUNERAÇÃO DE DEPÓSITOS BANCÁRIOS DE RECURSOS VINCULADOS -,"R$ 0,00","R$ 0,00"
865,2008-02,1.3.2.5.01.03,RECEITA DE REMUNERAÇÃO DE DEPÓSITOS BANCÁRIOS DE RECURSOS VINCULADOS -,"R$ 3.211.416,67","R$ 1.820.891,49"
877,2008-02,1.3.2.5.01.03,RECEITA DE REMUNERAÇÃO DE DEPÓSITOS BANCÁRIOS DE RECURSOS VINCULADOS -,"R$ 0,00","R$ 0,00"
889,2008-02,1.3.2.5.01.03,RECEITA DE REMUNERAÇÃO DE DEPÓSITOS BANCÁRIOS DE RECURSOS VINCULADOS -,"R$ 0,00","R$ 0,00"
901,2008-02,1.3.2.5.01.05,RECEITA DE REMUNERAÇÃO DE DEPÓSITOS BANCÁRIOS DE RECURSOS VINCULADOS -,"R$ 0,00","R$ 0,00"
913,2008-02,1.3.2.5.01.06,RECEITA DE REMUN.DE DEP. BANCÁRIOS DE REC. VINCULADOS - FUNDO DE SAÚDE,"R$ 0,00","R$ 0,00"
925,2008-02,1.3.2.5.01.06,RECEITA DE REMUN.DE DEP. BANCÁRIOS DE REC. VINCULADOS - FUNDO DE SAÚDE,"R$ 41,67","R$ 0,00"
937,2008-02,1.3.2.5.01.06,RECEITA DE REMUN.DE DEP. BANCÁRIOS DE REC. VINCULADOS - FUNDO DE SAÚDE,"R$ 666,67","R$ 721,07"
949,2008-02,1.3.2.5.01.06,RECEITA DE REMUN.DE DEP. BANCÁRIOS DE REC. VINCULADOS - FUNDO DE SAÚDE,"R$ 0,00","R$ 0,00"
961,2008-02,1.3.2.5.01.06,RECEITA DE REMUN.DE DEP. BANCÁRIOS DE REC. VINCULADOS - FUNDO DE SAÚDE,"R$ 0,00","R$ 0,00"
973,2008-02,1.3.2.5.01.99,RECEITA DE REMUNERAÇÃO DE OUTROS DEPÓSITOS BANCÁRIOS DE RECURSOS VINCU,"R$ 367.025,00","R$ 0,00"
985,2008-02,1.3.2.5.02.01,RECEITA DE REMUNERAÇÃO DE DEPÓSITOS DE POUPANÇA,"R$ 541.666,67","R$ 232.308,46"
997,2008-02,1.3.2.6.00.01,CONVÊNIO PMSP/SDTS - PLANSINE - FAT,"R$ 0,00","R$ 0,00"
1009,2008-02,1.3.2.6.00.02,CONVÊNIO PMSP/SDTS - PLANTEQ/2004 - FAT,"R$ 0,00","R$ 0,00"
1021,2008-02,1.3.2.6.00.03,CONVÊNIO MTE/SPPE/CODEFAT,"R$ 0,00","R$ 121.675,81"
1033,2008-02,1.3.2.8.10.01,REMUNERAÇÃO DOS INVESTIMENTOS EM RENDA FIXA,"R$ 416.666,67","R$ 159.584,00"
1045,2008-02,1.3.2.9.01.01,PMSP,"R$ 0,00","R$ 0,00"
1057,2008-02,1.3.2.9.01.01,PMSP,"R$ 0,00","R$ 0,00"
1069,2008-02,1.3.2.9.01.02,CÂMARA MUNICIPAL DE SÃO PAULO,"R$ 545.130,83","R$ 0,00"
1081,2008-02,1.3.2.9.01.03,TRIBUNAL DE CONTAS DO MUNICÍPIO DE SÃO PAULO,"R$ 27.009,83","R$ 94.517,87"
1093,2008-02,1.3.2.9.01.04,CEF - VALOR BLOQUEADO,"R$ 0,00","R$ 0,00"
1105,2008-02,1.3.2.9.01.05,OPERAÇÃO URBANA FARIA LIMA,"R$ 0,00","R$ 0,00"
1117,2008-02,1.3.2.9.01.06,OPERAÇÕES INTERLIGADAS,"R$ 28.767,00","R$ 347.796,65"
1129,2008-02,1.3.2.9.01.07,OPERAÇÃO URBANA ANHANGABAÚ,"R$ 0,00","R$ 0,00"
1141,2008-02,1.3.2.9.01.08,FUNDO ESPECIAL OPERAÇÃO URBANA ÁGUA BRANCA - FEAB,"R$ 0,00","R$ 0,00"
1153,2008-02,1.3.2.9.01.09,FEHIDRO - FUNDO ESTADUAL DE RECURSOS HÍDRICOS,"R$ 0,00","R$ 0,00"
1165,2008-02,1.3.2.9.01.10,PROGRAMA NACIONAL DE ALIMENTAÇÃO ESCOLAR - PNAE/FNDE,"R$ 91.666,67","R$ 1.609,11"
1177,2008-02,1.3.2.9.01.11,CONVÊNIO PMSP - MINISTÉRIO DA INTEGRAÇÃO NACIONAL - SEDEC,"R$ 0,00","R$ 0,00"
1189,2008-02,1.3.2.9.01.12,CONTRIBUIÇÃO PARA O CUSTEIO DO SERVIÇO DE ILUMINAÇÃO PÚBLICA - COSIP/F,"R$ 183.761,67","R$ 144.137,98"
1201,2008-02,1.3.2.9.01.13,INCENTIVO P/ A ATENÇÃO À SAÚDE NO SISTEMA PENITENCIÁRIO - SUS/FNS,"R$ 83,33","R$ 0,00"
1213,2008-02,1.3.2.9.01.14,PROGRAMA NACIONAL DE ALIMENTAÇÃO ESCOLAR - PNAE-CRECHE-SEMAB-FNDE,"R$ 10.000,00","R$ 0,00"
1225,2008-02,1.3.2.9.01.15,PLANO MUNICIPAL DE QUALIFICAÇÃO SOCIAL E PROFISSIONAL - PNQ/TEM,"R$ 0,00","R$ 0,00"
1237,2008-02,1.3.2.9.01.16,PROJETOS MUNICIPAIS DE EXPANSÃO DA SAÚDE DA FAMÍLIA - PROESF - FNS/FMS,"R$ 40.500,00","R$ 0,00"
1249,2008-02,1.3.2.9.01.19,PROGRAMA SÓCIO-EDUCATIVO EM MEIO ABERTO - ESPAÇO AMIGO - SAS,"R$ 0,00","R$ 0,00"
1261,2008-02,1.3.2.9.01.20,PROGRAMA DE ASSISTÊNCIA FARMACÊUTICA BÁSICA DO ESTADO DE SÃO PAULO - D,"R$ 47.666,67","R$ 43.047,40"
1273,2008-02,1.3.2.9.01.21,PROGRAMA PPD - SEGMENTO PESSOA COM DEFICIÊNCIA - SAS,"R$ 0,00","R$ 0,00"
1285,2008-02,1.3.2.9.01.22,CONVÊNIO Nº 800072/03 - FNDE/MEC - EDUCAÇÃO PRÉ-ES,"R$ 0,00","R$ 0,00"
1297,2008-02,1.3.2.9.01.23,CONVÊNIO Nº 804142/03 - FNDE/MEC -  ENSINO FUNDAME,"R$ 0,00","R$ 0,00"
1309,2008-02,1.3.2.9.01.24,CONVÊNIO Nº 808065/03 - FNDE/MEC - EDUCAÇÃO DE JOV,"R$ 0,00","R$ 0,00"
1321,2008-02,1.3.2.9.01.25,FUNDO ESPECIAL DE DESPESAS DA CÂMARA MUNICIPAL DE SÃO PAULO,"R$ 76.865,83","R$ 0,00"
1333,2008-02,1.3.2.9.01.27,PROGRAMA DE REESTRUTURAÇÃO URBANA - SISTEMA VIÁRIO JACU-PÊSSEGO/MINIST,"R$ 0,00","R$ 0,00"
1345,2008-02,1.3.2.9.01.28,CONVÊNIO N° 816169/2003-FNDE/MEC - EDUCAÇÃO ESPECI,"R$ 0,00","R$ 0,00"
1357,2008-02,1.3.2.9.01.31,FMAS - PROJETO RESTAURANTE ESCOLA,"R$ 435,00","R$ 0,00"
1369,2008-02,1.3.2.9.01.33,CENTRO MUNICIPAL DE EDUCAÇÃO TECNOLÓGICA - CONVÊNIO MEC/CEFET-SP,"R$ 24.750,00","R$ 624,36"
1381,2008-02,1.3.2.9.01.34,PROGRAMA @ LIS/ALIANÇA PARA A SOCIEDADE DA INFORMAÇÃO - SMCIS,"R$ 0,00","R$ 0,00"
1393,2008-02,1.3.2.9.01.35,PMSP/SMRI - SAÚDE PÚBLICA,"R$ 0,00","R$ 0,00"
1405,2008-02,1.3.2.9.01.36,PROTEÇÃO SOCIAL BÁSICA/FMAS,"R$ 75.428,00","R$ 395,64"
1417,2008-02,1.3.2.9.01.37,PROTEÇÃO SOCIAL ESPECIAL/FMAS,"R$ 85.954,00","R$ 469,64"
1429,2008-02,1.3.2.9.01.38,PROGRAMA BRASIL POTÊNCIA ESPORTIVA,"R$ 0,00","R$ 0,00"
1441,2008-02,1.3.2.9.01.40,MINISTÉRIO DO ESPORTE/CEF X SEME,"R$ 27.125,00","R$ 0,00"
1453,2008-02,1.3.2.9.01.41,PMSP/SAS/FMAS,"R$ 63.330,00","R$ 61.284,07"
1465,2008-02,1.3.2.9.01.42,CONVÊNIO MEC/FNDE - ASSISTÊNCIA FINANCEIRA A PROGRAMAS E PROJETOS EDUC,"R$ 0,00","R$ 19.743,75"
1477,2008-02,1.3.2.9.01.43,RADIAL LESTE,"R$ 0,00","R$ 0,00"
1489,2008-02,1.3.2.9.01.44,PROGRAMA NACIONAL DE APOIO AO TRANSPORTE DO ESCOLAR - PNATE,"R$ 0,00","R$ 6.507,13"
1501,2008-02,1.3.2.9.01.45,"PROGRAMA URB-AL, REDE N° 10","R$ 0,00","R$ 0,00"
1513,2008-02,1.3.2.9.01.46,MÉDIA E ALTA COMPLEXIDADE VIGILÂNCIA SANITÁRIA - MAC - FNS/FMS,"R$ 38.500,00","R$ 0,00"
1525,2008-02,1.3.2.9.01.50,SECRETARIA DE ESTADO DA SAÚDE - SMS/FMS,"R$ 37.750,00","R$ 5.391,63"
1537,2008-02,1.3.2.9.01.51,PROGRAMA URB-AL - PROJETO COMUM R3-B1-04 - OBSERVATÓRIOS LOCAIS DA DEM,"R$ 0,00","R$ 0,00"
1549,2008-02,1.3.2.9.01.52,PROGRAMA CENTROS DE ESPECIALIDADES ODONTOLÓGICAS - FNS/SMS,"R$ 13.833,33","R$ 15.071,59"
1561,2008-02,1.3.2.9.01.53,FEPAC,"R$ 3.000,00","R$ 0,00"
1573,2008-02,1.3.2.9.01.54,FUMCAD,"R$ 632.000,00","R$ 322.219,75"
1585,2008-02,1.3.2.9.01.55,FUTUR,"R$ 0,00","R$ 0,00"
1597,2008-02,1.3.2.9.01.56,FUNCOR,"R$ 0,00","R$ 0,00"
1609,2008-02,1.3.2.9.01.57,FUNDO CONSTITUCIONAL DA EDUCAÇÃO,"R$ 0,00","R$ 80.815,06"
1621,2008-02,1.3.2.9.01.58,FMAS - FUNDO MUNICIPAL DE ASSISTÊNCIA SOCIAL,"R$ 365.373,00","R$ 18.109,27"
1633,2008-02,1.3.2.9.01.59,FEMA - FUNDO ESPECIAL DO MEIO AMBIENTE E DESENVVOLVIMENTO SUSTENTÁVEL,"R$ 0,00","R$ 23.101,61"
1645,2008-02,1.3.2.9.01.60,PETI-PROGRAMA DE ERRADICAÇÃO DO TRABALHO INFANTIL - FNAS/FMAS,"R$ 9.677,00","R$ 0,00"
1657,2008-02,1.3.2.9.01.61,VIGISUS - FORTALECIMENTO DA GESTÃO EM VIGILÂNCIA - MS-FNS - SMS/FMS,"R$ 6.500,00","R$ 11.876,46"
1669,2008-02,1.3.2.9.01.62,CONVÊNIO PMSP/SMPP X UNIÃO,"R$ 0,00","R$ 0,00"
1681,2008-02,1.3.2.9.01.63,TERMINAL DE CARGAS FERNÃO DIAS/MT-DNIT/SP-MG,"R$ 0,00","R$ 335.069,75"
1693,2008-02,1.3.2.9.01.64,CONVÊNIO SSP/SP - SGM/CSU,"R$ 76.460,83","R$ 0,00"
1705,2008-02,1.3.2.9.01.65,PROGRAMA URB-AL - PROJETO COMUM R12 A1-04,"R$ 0,00","R$ 0,00"
1717,2008-02,1.3.2.9.01.66,OUTROS PROGRAMAS FINANCIADOS P/ TRANSFERÊNCIAS FUNDO A FUNDO,"R$ 104.583,33","R$ 125.481,76"
1729,2008-02,1.3.2.9.01.67,PROGRAMA URB - AL,"R$ 0,00","R$ 0,00"
1741,2008-02,1.3.2.9.01.68,CONVÊNIO MTE/SPPE X PMSP/SMTRAB - PROJOVEM,"R$ 0,00","R$ 0,00"
1753,2008-02,1.3.2.9.01.69,CONVÊNIO SENASP,"R$ 29.266,67","R$ 0,00"
1765,2008-02,1.3.2.9.01.70,RENDIMENTOS DE APLICAÇÕES FINANCEIRAS - ADM. INDIR,"R$ 481.254,92","R$ 127.953,72"
1777,2008-02,1.3.2.9.01.71,CONVÊNIO CITY JARAGUÁ,"R$ 26.227,50","R$ 455,92"
1789,2008-02,1.3.2.9.01.72,FUNCAP,"R$ 0,00","R$ 0,00"
1801,2008-02,1.3.2.9.01.73,CONVÊNIO SIURB - ESTADO,"R$ 0,00","R$ 14,88"
1813,2008-02,1.3.2.9.01.74,CONVÊNIO SMADS - UNIÃO EUROPÉIA,"R$ 0,00","R$ 0,00"
1825,2008-02,1.3.2.9.01.75,PMSP/SMADS/FMAS - PAC II POP RUA,"R$ 970,00","R$ 0,00"
1837,2008-02,1.3.2.9.01.76,CONVÊNIO PMSP/SMRI/REGIÃO ILE DE FRANCE,"R$ 0,00","R$ 1.603,60"
1849,2008-02,1.3.2.9.01.77,CONVÊNIO MINISTÉRIO DO TURISMO,"R$ 0,00","R$ 0,00"
1861,2008-02,1.3.2.9.01.78,RENDIMENTOS DE APLICAÇÕES FINANCEIRAS - ADM. INDIR,"R$ 170.833,33","R$ 220.788,39"
1873,2008-02,1.3.2.9.01.79,CONVÊNIO SME - ESTADO,"R$ 0,00","R$ 0,00"
1885,2008-02,1.3.2.9.01.81,INSTITUIÇÕES PRIVADAS X SMS,"R$ 0,00","R$ 0,00"
1897,2008-02,1.3.2.9.01.82,CONVÊNIO SMC - EXTERIOR,"R$ 0,00","R$ 0,00"
1909,2008-02,1.3.2.9.01.83,RENDIMENTOS DE APLICAÇÕES FINANCEIRAS - ADM. INDIR,"R$ 0,00","R$ 0,00"
1921,2008-02,1.3.2.9.01.83,RENDIMENTOS DE APLICAÇÕES FINANCEIRAS - ADM. INDIR,"R$ 0,00","R$ 0,00"
1933,2008-02,1.3.2.9.02.01,TRANSFERÊNCIAS DO SALÁRIO EDUCAÇÃO - LEI 10.832/03,"R$ 1.895.726,25","R$ 3.229.100,40"
1945,2008-02,1.3.2.9.02.02,CONVÊNIOS MINC/SMC,"R$ 16.666,67","R$ 14.293,58"
1957,2008-02,1.3.3.9.99.01,"RENDAS DE MERCADOS, FEIRAS E FRIGORÍFICOS (ANT. MAT.) - SISTEMA VELHO","R$ 0,00","R$ 3.700,74"
1969,2008-02,1.3.3.9.99.02,"RENDAS DE MERCADOS, FEIRAS E FRIGORÍFICOS (ANT. MAT.) - SISTEMA NOVO","R$ 875.000,00","R$ 161.932,87"
1981,2008-02,1.3.3.9.99.03,ESTÁDIO MUNICIPAL,"R$ 175.000,00","R$ 12.700,00"
1993,2008-02,1.3.3.9.99.04,AUTÓDROMO,"R$ 0,00","R$ 0,00"
2005,2008-02,1.3.3.9.99.05,KARTÓDROMO,"R$ 0,00","R$ 0,00"
2017,2008-02,1.3.3.9.99.06,CENTROS ESPORTIVOS - UNIDADES EDUCACIONAIS E ESPORTIVAS,"R$ 15.000,00","R$ 10.937,75"
2029,2008-02,1.3.3.9.99.07,CENTROS CULTURAIS - TEATROS/PMSP,"R$ 0,00","R$ 0,00"
2041,2008-02,1.3.3.9.99.08,CENTROS CULTURAIS - TEATROS/FEPAC,"R$ 38.000,00","R$ 23.098,69"
2053,2008-02,1.3.3.9.99.09,PERMISSÃO DE ATIVIDADES AMBULANTES,"R$ 0,00","R$ 0,00"
2065,2008-02,1.3.3.9.99.10,TARIFA DE PEDÁGIO P/ INGRESSO NAS RUAS DE PEDESTRES,"R$ 33.333,33","R$ 22.736,70"
2077,2008-02,1.3.3.9.99.12,CONCESSÃO PARA EXPLORAÇÃO COMERCIAL EM ESTACIONAMENTO SUBTERRÂNEO - SM,"R$ 4.166,67","R$ 1.528,56"
2089,2008-02,1.3.3.9.99.13,"IMPLANTAÇÃO, INSTALAÇÃO E PASSAGEM DE EQUIPAMENTOS URBANOS - CONVIAS","R$ 66.666,67","R$ 23.202,46"
2101,2008-02,1.3.3.9.99.14,OUTORGA ONEROSA - PRESTAÇÃO DE SERVIÇOS DE LIMPEZA URBANA EM REGIME PÚ,"R$ 0,00","R$ 0,00"
2113,2008-02,1.3.3.9.99.15,CONTRATOS DE CONCESSÃO E PERMISSÃO DOS SERVIÇOS DE LIMPEZA URBANA - FM,"R$ 2.500.000,00","R$ 3.651.055,37"
2125,2008-02,1.3.3.9.99.16,OUTRAS RECEITAS DE CONCESSÕES E PERMISSÕES,"R$ 666,67","R$ 0,00"
2137,2008-02,1.3.3.9.99.17,UNIDADES ESPORTIVAS DA SEME,"R$ 8.333,33","R$ 0,00"
2149,2008-02,1.3.4.0.01,UTILIZAÇÃO DE RECURSOS HÍDRICOS - ITAIPU,"R$ 83,33","R$ 0,00"
2161,2008-02,1.3.9.0.01.01,REMUNERAÇÕES DIVERSAS,"R$ 208.333,33","R$ 152.449,65"
2173,2008-02,1.3.9.0.02.01,BANCO ITAÚ S/A.,"R$ 0,00","R$ 0,00"
2185,2008-02,1.3.9.0.02.03,BANCO BRADESCO S/A.,"R$ 0,00","R$ 0,00"
2197,2008-02,1.5.2.0.28.01,SUBPRODUTOS DA LIMPEZA PÚBLICA,"R$ 16.666,67","R$ 0,00"
2209,2008-02,1.5.2.0.29.01,GRÁFICA MUNICIPAL,"R$ 0,00","R$ 0,00"
2221,2008-02,1.6.0.0.01.01,SERVIÇOS DE COMERCIALIZAÇÃO DE MEDICAMENTOS,"R$ 100.000,00","R$ 4.142,53"
2233,2008-02,1.6.0.0.01.06,"SERVIÇO DE COMERCIALIZAÇÃO DE PRODUTOS, DADOS E MATERIAIS DE INFORMÁTI","R$ 0,00","R$ 0,00"
2245,2008-02,1.6.0.0.02.07,SERVIÇOS DE COMISSÕES PELA PRESTAÇÃO DE SERVIÇOS,"R$ 2.083,33","R$ 17.403,97"
2257,2008-02,1.6.0.0.02.99,OUTROS SERVIÇOS FINANCEIROS,"R$ 507.083,33","R$ 0,00"
2269,2008-02,1.6.0.0.02.99,OUTROS SERVIÇOS FINANCEIROS,"R$ 0,00","R$ 4.167,52"
2281,2008-02,1.6.0.0.02.99,OUTROS SERVIÇOS FINANCEIROS,"R$ 0,00","R$ 16.512,82"
2293,2008-02,1.6.0.0.02.99,OUTROS SERVIÇOS FINANCEIROS,"R$ 0,00","R$ 57.600,20"
2305,2008-02,1.6.0.0.02.99,OUTROS SERVIÇOS FINANCEIROS,"R$ 0,00","R$ 325.665,06"
2317,2008-02,1.6.0.0.03.99,OUTROS SERVIÇOS DE TRANSPORTE,"R$ 1.369.166,67","R$ 1.000.656,27"
2329,2008-02,1.6.0.0.05.01,SERVIÇOS HOSPITALARES - FMS,"R$ 0,00","R$ 0,00"
2341,2008-02,1.6.0.0.05.01,SERVIÇOS HOSPITALARES - FMS,"R$ 0,00","R$ 0,00"
2353,2008-02,1.6.0.0.05.01,SERVIÇOS HOSPITALARES - FMS,"R$ 2.619.500,00","R$ 2.530.967,78"
2365,2008-02,1.6.0.0.05.01,SERVIÇOS HOSPITALARES - FMS,"R$ 0,00","R$ 0,00"
2377,2008-02,1.6.0.0.05.01,SERVIÇOS HOSPITALARES - FMS,"R$ 0,00","R$ 0,00"
2389,2008-02,1.6.0.0.05.02,SERVIÇOS DE REGISTRO DE ANÁLISE E DE CONTROLE DE PRODUTOS SUJEITOS A N,"R$ 0,00","R$ 0,00"
2401,2008-02,1.6.0.0.05.02,SERVIÇOS DE REGISTRO DE ANÁLISE E DE CONTROLE DE PRODUTOS SUJEITOS A N,"R$ 0,00","R$ 0,00"
2413,2008-02,1.6.0.0.05.03,SERVIÇOS RADIOLÓGICOS E LABOARATORIAIS - FMS,"R$ 0,00","R$ 0,00"
2425,2008-02,1.6.0.0.05.03,SERVIÇOS RADIOLÓGICOS E LABOARATORIAIS - FMS,"R$ 0,00","R$ 0,00"
2437,2008-02,1.6.0.0.05.03,SERVIÇOS RADIOLÓGICOS E LABOARATORIAIS - FMS,"R$ 1.604.583,33","R$ 1.429.139,80"
2449,2008-02,1.6.0.0.05.03,SERVIÇOS RADIOLÓGICOS E LABOARATORIAIS - FMS,"R$ 0,00","R$ 0,00"
2461,2008-02,1.6.0.0.05.03,SERVIÇOS RADIOLÓGICOS E LABOARATORIAIS - FMS,"R$ 0,00","R$ 0,00"
2473,2008-02,1.6.0.0.05.04,SERVIÇOS AMBULATORIAIS - FMS,"R$ 0,00","R$ 0,00"
2485,2008-02,1.6.0.0.05.04,SERVIÇOS AMBULATORIAIS - FMS,"R$ 0,00","R$ 0,00"
2497,2008-02,1.6.0.0.05.04,SERVIÇOS AMBULATORIAIS - FMS,"R$ 3.793.416,67","R$ 3.232.350,22"
2509,2008-02,1.6.0.0.05.04,SERVIÇOS AMBULATORIAIS - FMS,"R$ 0,00","R$ 0,00"
2521,2008-02,1.6.0.0.05.04,SERVIÇOS AMBULATORIAIS - FMS,"R$ 0,00","R$ 0,00"
2533,2008-02,1.6.0.0.05.98,OUTROS SERVIÇOS DE SAÚDE - ADMINISTRAÇÃO INDIRETA,"R$ 16,67","R$ 0,00"
2545,2008-02,1.6.0.0.05.99,OUTROS SERVIÇOS DE SAÚDE - FMS,"R$ 0,00","R$ 0,00"
2557,2008-02,1.6.0.0.13.01,SERVIÇOS DE INSCRIÇÃO EM CONCURSOS PÚBLICOS,"R$ 0,00","R$ 0,00"
2569,2008-02,1.6.0.0.13.01,SERVIÇOS DE INSCRIÇÃO EM CONCURSOS PÚBLICOS,"R$ 0,00","R$ 0,00"
2581,2008-02,1.6.0.0.13.01,SERVIÇOS DE INSCRIÇÃO EM CONCURSOS PÚBLICOS,"R$ 0,00","R$ 0,00"
2593,2008-02,1.6.0.0.13.01,SERVIÇOS DE INSCRIÇÃO EM CONCURSOS PÚBLICOS,"R$ 116,00","R$ 0,00"
2605,2008-02,1.6.0.0.13.01,SERVIÇOS DE INSCRIÇÃO EM CONCURSOS PÚBLICOS,"R$ 0,00","R$ 0,00"
2617,2008-02,1.6.0.0.13.01,SERVIÇOS DE INSCRIÇÃO EM CONCURSOS PÚBLICOS,"R$ 0,00","R$ 0,00"
2629,2008-02,1.6.0.0.13.01,SERVIÇOS DE INSCRIÇÃO EM CONCURSOS PÚBLICOS,"R$ 0,00","R$ 0,00"
2641,2008-02,1.6.0.0.13.01,SERVIÇOS DE INSCRIÇÃO EM CONCURSOS PÚBLICOS,"R$ 0,00","R$ 0,00"
2653,2008-02,1.6.0.0.13.01,SERVIÇOS DE INSCRIÇÃO EM CONCURSOS PÚBLICOS,"R$ 116,00","R$ 0,00"
2665,2008-02,1.6.0.0.13.01,SERVIÇOS DE INSCRIÇÃO EM CONCURSOS PÚBLICOS,"R$ 0,00","R$ 0,00"
2677,2008-02,1.6.0.0.13.02,SERVIÇOS DE VENDA DE EDITAIS,"R$ 0,00","R$ 0,00"
2689,2008-02,1.6.0.0.13.02,SERVIÇOS DE VENDA DE EDITAIS,"R$ 83,33","R$ 30,25"
2701,2008-02,1.6.0.0.13.02,SERVIÇOS DE VENDA DE EDITAIS,"R$ 0,00","R$ 0,00"
2713,2008-02,1.6.0.0.13.02,SERVIÇOS DE VENDA DE EDITAIS,"R$ 116,08","R$ 0,00"
2725,2008-02,1.6.0.0.13.02,SERVIÇOS DE VENDA DE EDITAIS,"R$ 0,00","R$ 0,00"
2737,2008-02,1.6.0.0.13.02,SERVIÇOS DE VENDA DE EDITAIS,"R$ 0,00","R$ 0,00"
2749,2008-02,1.6.0.0.13.02,SERVIÇOS DE VENDA DE EDITAIS,"R$ 83,33","R$ 0,00"
2761,2008-02,1.6.0.0.13.02,SERVIÇOS DE VENDA DE EDITAIS,"R$ 0,00","R$ 0,00"
2773,2008-02,1.6.0.0.13.02,SERVIÇOS DE VENDA DE EDITAIS,"R$ 116,08","R$ 0,00"
2785,2008-02,1.6.0.0.13.02,SERVIÇOS DE VENDA DE EDITAIS,"R$ 0,00","R$ 0,00"
2797,2008-02,1.6.0.0.13.04,SERVIÇOS DE EXPEDIÇÃO DE CERTIFICADOS,"R$ 0,00","R$ 0,00"
2809,2008-02,1.6.0.0.13.04,SERVIÇOS DE EXPEDIÇÃO DE CERTIFICADOS,"R$ 0,00","R$ 0,00"
2821,2008-02,1.6.0.0.13.04,SERVIÇOS DE EXPEDIÇÃO DE CERTIFICADOS,"R$ 0,00","R$ 0,00"
2833,2008-02,1.6.0.0.13.06,SERVIÇOS DE FORNECIMENTO DE LISTAGENS,"R$ 0,00","R$ 0,00"
2845,2008-02,1.6.0.0.13.07,SERVIÇOS DE FOTOCÓPIAS OU CÓPIAS HELIOGRÁFICAS,"R$ 0,00","R$ 18,25"
2857,2008-02,1.6.0.0.13.07,SERVIÇOS DE FOTOCÓPIAS OU CÓPIAS HELIOGRÁFICAS,"R$ 0,00","R$ 0,00"
2869,2008-02,1.6.0.0.13.07,SERVIÇOS DE FOTOCÓPIAS OU CÓPIAS HELIOGRÁFICAS,"R$ 0,00","R$ 0,00"
2881,2008-02,1.6.0.0.13.07,SERVIÇOS DE FOTOCÓPIAS OU CÓPIAS HELIOGRÁFICAS,"R$ 584,00","R$ 0,00"
2893,2008-02,1.6.0.0.13.07,SERVIÇOS DE FOTOCÓPIAS OU CÓPIAS HELIOGRÁFICAS,"R$ 0,00","R$ 0,00"
2905,2008-02,1.6.0.0.13.07,SERVIÇOS DE FOTOCÓPIAS OU CÓPIAS HELIOGRÁFICAS,"R$ 0,00","R$ 34,00"
2917,2008-02,1.6.0.0.13.07,SERVIÇOS DE FOTOCÓPIAS OU CÓPIAS HELIOGRÁFICAS,"R$ 0,00","R$ 13,55"
2929,2008-02,1.6.0.0.13.07,SERVIÇOS DE FOTOCÓPIAS OU CÓPIAS HELIOGRÁFICAS,"R$ 0,00","R$ 0,00"
2941,2008-02,1.6.0.0.13.07,SERVIÇOS DE FOTOCÓPIAS OU CÓPIAS HELIOGRÁFICAS,"R$ 584,00","R$ 0,00"
2953,2008-02,1.6.0.0.13.07,SERVIÇOS DE FOTOCÓPIAS OU CÓPIAS HELIOGRÁFICAS,"R$ 0,00","R$ 0,00"
2965,2008-02,1.6.0.0.13.08,SERVIÇOS DE EXPEDIENTES,"R$ 0,00","R$ 0,00"
2977,2008-02,1.6.0.0.13.08,SERVIÇOS DE EXPEDIENTES,"R$ 0,00","R$ 0,00"
2989,2008-02,1.6.0.0.13.08,SERVIÇOS DE EXPEDIENTES,"R$ 0,00","R$ 0,00"
3001,2008-02,1.6.0.0.13.08,SERVIÇOS DE EXPEDIENTES,"R$ 0,00","R$ 0,00"
3013,2008-02,1.6.0.0.13.11,REQUISIÇÃO DE SERVIÇOS - FISC,"R$ 0,00","R$ 0,00"
3025,2008-02,1.6.0.0.13.12,REMOÇÃO E ESTADIA - DSV,"R$ 1.854.166,67","R$ 0,00"
3037,2008-02,1.6.0.0.13.13,AUTUAÇÃO DE PROCESSOS - DAMSP,"R$ 100.000,00","R$ 89.119,80"
3049,2008-02,1.6.0.0.13.14,AUTUAÇÃO DE PROCESSOS - G. A. 99-T,"R$ 15.083,33","R$ 12.985,85"
3061,2008-02,1.6.0.0.13.15,"ANÁLISE DE ESTUDOS, PLANOS, PROJETOS E RELATÓRIOS - DECONT","R$ 0,00","R$ 0,00"
3073,2008-02,1.6.0.0.13.16,"DESINTERDIÇÃO, FISCALIZAÇÃO E VISTORIA - DECONT","R$ 0,00","R$ 958,20"
3085,2008-02,1.6.0.0.13.17,EMISSÃO DE LICENÇAS AMBIENTAIS - DECONT,"R$ 0,00","R$ 0,00"
3097,2008-02,1.6.0.0.13.18,SERVIÇOS DE TRANSPORTE DO DTP,"R$ 1.037.500,00","R$ 816.313,82"
3109,2008-02,1.6.0.0.13.19,RECEITA DE REGISTROS DE PROFISSIONAIS E FIRMAS,"R$ 3.750,00","R$ 1.954,70"
3121,2008-02,1.6.0.0.13.20,TERMO DE PERMISSÃO DE USO - TPU,"R$ 833.333,33","R$ 100.690,97"
3133,2008-02,1.6.0.0.13.23,LICENÇA ESPECIAL DE TRÂNSITO DE PRODUTOS PERIGOSOS - SMT,"R$ 3.750,00","R$ 523,50"
3145,2008-02,1.6.0.0.13.24,PANFLETAGEM - PROGRAMAS SOCIAIS - PMSP,"R$ 0,00","R$ 0,00"
3157,2008-02,1.6.0.0.13.25,CADASTRAMENTO DE AMBULANTES,"R$ 0,00","R$ 0,00"
3169,2008-02,1.6.0.0.13.26,TERMO DE PERMISSÃO DE USO - CONVIAS,"R$ 4.166,67","R$ 1.472,00"
3181,2008-02,1.6.0.0.13.27,APROVAÇÃO DE PROJETOS - CONVIAS,"R$ 11.666,67","R$ 23.361,75"
3193,2008-02,1.6.0.0.13.99,OUTROS SERVIÇOS ADMINISTRATIVOS,"R$ 66.666,67","R$ 93.358,88"
3205,2008-02,1.6.0.0.13.99,OUTROS SERVIÇOS ADMINISTRATIVOS,"R$ 0,00","R$ 0,00"
3217,2008-02,1.6.0.0.13.99,OUTROS SERVIÇOS ADMINISTRATIVOS,"R$ 0,00","R$ 0,00"
3229,2008-02,1.6.0.0.13.99,OUTROS SERVIÇOS ADMINISTRATIVOS,"R$ 66.666,67","R$ 83.593,04"
3241,2008-02,1.6.0.0.13.99,OUTROS SERVIÇOS ADMINISTRATIVOS,"R$ 0,00","R$ 0,00"
3253,2008-02,1.6.0.0.13.99,OUTROS SERVIÇOS ADMINISTRATIVOS,"R$ 0,00","R$ 0,00"
3265,2008-02,1.6.0.0.13.99,OUTROS SERVIÇOS ADMINISTRATIVOS,"R$ 66.666,67","R$ 56.399,19"
3277,2008-02,1.6.0.0.13.99,OUTROS SERVIÇOS ADMINISTRATIVOS,"R$ 0,00","R$ 0,00"
