id,data,codigo,descricao,previsto_mensal,realizado_mensal
20981,2009-06,9.3.2.9.01.16,DEDUÇÕES DOS PROJETOS MUNICIPAIS DE EXPANSÃO DA SAÚDE DA FAMÍLIA - PRO,"R$ 0,00","R$ 0,00"
20993,2009-06,9.3.2.9.01.36,DEDUÇÕES DA PROTEÇÃO SOCIAL BÁSICA/FMAS,"R$ 0,00","R$ 0,00"
21005,2009-06,9.3.2.9.01.37,DEDUÇÕES DA PROTEÇÃO SOCIAL ESPECIAL/FMAS,"R$ 0,00","R$ 0,00"
21017,2009-06,9.3.2.9.01.42,DEDUÇÕES DO CONVÊNIO MEC/FNDE - ASSISTÊNCIA FINANCEIRA A PROGRAMAS E P,"R$ 0,00","R$ 0,00"
21029,2009-06,9.3.2.9.01.43,DEDUÇÃO RADIAL LESTE,"R$ 0,00","R$ 0,00"
21041,2009-06,9.3.2.9.01.50,DEDUÇÕES DA SECRETARIA DE ESTADO DA SAÚDE - SMS/FMS,"R$ 0,00","R$ 0,00"
21053,2009-06,9.3.2.9.01.58,DEDUÇÕES DO FMAS - FUNDO MUNICIPAL DE ASSISTÊNCIA SOCIAL,"R$ 0,00","R$ 0,00"
21065,2009-06,9.3.3.9.99.02,"DEDUÇÕES DAS RENDAS DE MERCADOS, FEIRAS E FRIGORIFICOS (ANT.MAT.) - SI","R$ 0,00","-R$ 188,16"
21077,2009-06,9.3.9.0.01.01,DEDUÇÕES DE REMUNERAÇÕES DIVERSAS,"R$ 0,00","-R$ 81,73"
21089,2009-06,9.6.0.0.13.08,DEDUÇÕES DE SERVIÇOS DE EXPEDIENTES,"R$ 0,00","R$ 0,00"
21101,2009-06,9.6.0.0.13.12,DEDUÇÕES DE REMOÇÃO E ESTADIA - DSV,"R$ 0,00","R$ 0,00"
21113,2009-06,9.6.0.0.13.13,DEDUÇÕES DE AUTUAÇÕES DE PROCESSOS - DAMSP,"R$ 0,00","-R$ 282,00"
21125,2009-06,9.6.0.0.13.14,DEDUÇÕES DE AUTUAÇÃO DE PROCESSOS - G. A. 99-T,"R$ 0,00","R$ 0,00"
21137,2009-06,9.6.0.0.13.18,DEDUÇÕES DE SERVIÇOS DE TRANSPORTE DO DTP,"R$ 0,00","-R$ 879,48"
21149,2009-06,9.6.0.0.13.20,DEDUÇÕES DO TERMO DE PERMISSÃO DE USO - TPU,"R$ 0,00","R$ 0,00"
21161,2009-06,9.6.0.0.13.24,DEDUÇÕES DE PANFLETAGEM - PROGRAMAS SOCIAIS - PMSP,"R$ 0,00","R$ 0,00"
21173,2009-06,9.6.0.0.43.01,DEDUÇÕES DA COLETA DE RESÍDUOS SÓLIDOS - SAÚDE - LIMPURB,"R$ 0,00","R$ 0,00"
21185,2009-06,9.6.0.0.99.19,DEDUÇÕES DE OUTROS SERVIÇOS,"R$ 0,00","R$ 0,00"
21197,2009-06,9.7.2.1.01.02,DEDUÇÃO DE RECEITA DO FPM - FUNDEB E REDUTOR FINANCEIRO (CORRESP. 1721,"-R$ 2.333.333,33","-R$ 2.009.185,42"
21209,2009-06,9.7.2.1.01.05,DEDUÇÃO DE RECEITA PARA A FORMAÇÃO DO FUNDEB - ITR (CORRESP. 1721.01.0,"-R$ 33.333,33","-R$ 3.192,92"
21221,2009-06,9.7.2.1.36,DEDUÇÃO DE RECEITA PARA FORMAÇÃO DO FUNDEB - ICMS DESONERAÇÃO - LEI CO,"-R$ 700.000,00","-R$ 599.832,11"
21233,2009-06,9.7.2.2.01.01,DEDUÇÃO DE RECEITA PARA A FORMAÇÃO DO FUNDEB - ICMS (CORRESP. 1722.01.,"-R$ 71.200.000,00","-R$ 83.515.261,25"
21245,2009-06,9.7.2.2.01.02,DEDUÇÃO DE RECEITA PARA A FORMAÇÃO DO FUNDEB - IPVA (CORRESP. 1722.01.,"-R$ 27.366.666,67","-R$ 11.440.041,81"
21257,2009-06,9.7.2.2.01.04,DEDUÇÃO DE RECEITA PARA A FORMAÇÃO DO FUNDEB - IPI - EXPORTAÇÃO (CORRE,"-R$ 716.666,67","-R$ 603.212,69"
21269,2009-06,9.7.6.1.03.01,DEDUÇÕES PMSP/SAS/FMAS,"R$ 0,00","R$ 0,00"
21281,2009-06,9.7.6.1.99.13,DEDUÇÕES DA PMSP/SDTS - PLANSINE - FAT,"R$ 0,00","R$ 0,00"
21293,2009-06,9.7.6.1.99.20,DEDUÇÕES DO CONVÊNIO MTE/SPPE/CODEFAT,"R$ 0,00","R$ 0,00"
21305,2009-06,9.9.1.1.40.01,DEDUÇÕES DAS MULTAS E JUROS DE MORA DO IMPOSTO S/,"R$ 0,00","R$ 0,00"
21317,2009-06,9.9.1.9.11.02,DEDUÇÕES DAS MULTAS SMSP - SISTEMA NOVO,"R$ 0,00","R$ 0,00"
21329,2009-06,9.9.1.9.15.01,DEDUÇÕES DE MULTAS DE TRÂNSITO - DSV - FMDT,"R$ 0,00","-R$ 25.747,57"
21341,2009-06,9.9.1.9.27.02,DEDUÇÕES DAS MULTAS E JUROS/CONTRATOS PMSP,"R$ 0,00","-R$ 2.815,55"
21353,2009-06,9.9.1.9.99.01,DEDUÇÕES DE MULTAS E JUROS DIVERSOS - PMSP,"R$ 0,00","R$ 0,00"
21365,2009-06,9.9.2.2.99.01,DEDUÇÕES DE RESTITUIÇÕES DIVERSAS,"R$ 0,00","R$ 0,00"
21377,2009-06,9.9.3.1.99.01,DEDUÇÕES DA RECEITA DA DÍVIDA ATIVA DE OUTROS TRIBUTOS - PRINCIPAL - P,"R$ 0,00","-R$ 1.829,67"
21389,2009-06,9.9.3.1.99.03,DEDUÇÕES DE FISC,"R$ 0,00","R$ 0,00"
21401,2009-06,9.9.3.2.99.06,DEDUÇÕES DA RECEITA DA DÍVIDA ATIVA NÃO TRIBUTÁRIA DE OUTRAS RECEITAS,"R$ 0,00","R$ 0,00"
21413,2009-06,9.9.9.0.01.01,DEDUÇÕES DO REFIS,"R$ 0,00","R$ 0,00"
21425,2009-06,9.9.9.0.01.02,DEDUÇÕES DO PROGRAMA DE PARCELAMENTO INCENTIVADO - PPI,"R$ 0,00","-R$ 11.436,68"
21437,2009-06,9.9.9.0.02.01,DEDUÇÕES DA RECEITA DE HONORÁRIOS DE ADVOGADOS,"R$ 0,00","R$ 0,00"
21449,2009-06,9.9.9.0.99.01,DEDUÇÕES DAS OUTRAS RECEITAS - FEPAC,"R$ 0,00","R$ 0,00"
21461,2009-06,9.9.9.0.99.04,DEDUÇÕES DE TARIFA BANCÁRIA,"R$ 0,00","R$ 0,00"
21473,2009-06,9.9.9.0.99.22,DEDUÇÕES DE EVENTUAIS DIVERSOS - PMSP,"R$ 0,00","R$ 0,00"
21485,2009-06,9.9.9.0.99.23,DEDUÇÕES DOS LEILÕES - DSV/SPTRANS/CET,"R$ 0,00","R$ 0,00"
